"text","text_en","cmp_code","eu_code"
"Deutschland.","Germany.","H",NA
"Aber normal.","But normal.","H",NA
"Programm der Alternative für Deutschland für die Wahl zum 20. Deutschen Bundestag","Program of the Alternative for Germany for the election to the 20th German Bundestag","H",NA
"Demokratie und Rechtsstaat 12","Democracy and the rule of law 12",NA,NA
"Das Volk ist der Souverän 12","The people are the sovereign 12",NA,NA
"Volksabstimmungen nach Schweizer Modell 12","Referendums based on the Swiss model 12",NA,NA
"Die Gewaltenteilung gewährleisten 14","Ensuring the separation of powers 14",NA,NA
"Entpolitisierung der Justiz 15","Depoliticization of the judiciary 15",NA,NA
"Verfassungsschutz reformieren 15","Reform constitutional protection 15",NA,NA
"Trennung von Amt und Mandat und Kampf der Ämterpatronage 16","Separation of office and mandate and the fight against office patronage 16",NA,NA
"Macht der Parteien beschränken 16","Limiting the power of the parties 16",NA,NA
"Freie Listenwahl und freies Mandat 17","Free list election and free mandate 17",NA,NA
"Verkleinerung der Parlamente 18","Reduction in the size of parliaments 18",NA,NA
"Berufspolitikertum: Mandats- und Amtszeiten begrenzen 18","Professional politicians: limit terms of office 18",NA,NA
"Lobbyismus eindämmen 18","Curbing lobbying 18",NA,NA
"Freiheit und Verantwortung 19","Freedom and responsibility 19",NA,NA
"Leistung statt Quote - Freiheit statt Diskriminierung 19","Performance instead of quota - freedom instead of discrimination 19",NA,NA
"Schutz der persönlichen Freiheit vor digitalen Übergriffen 20","Protecting personal freedom from digital assaults 20",NA,NA
"Hinweisgeber (Whistleblower) schützen 20","Protect whistleblowers 20",NA,NA
"Bürgerlich- freiheitliche Rechtsordnung 21","Civil liberties legal order 21",NA,NA
"EU und Europa 26","EU and Europe 26",NA,NA
"Ein Europa der Vaterländer 26","A Europe of Fatherlands 26",NA,NA
"Zurückführung der Europäischen Union in einen Staatenbund souveräner Staaten 27","Return of the European Union to a Confederation of Sovereign States 27",NA,NA
"Steuern und Finanzen 32","Taxes and finances 32",NA,NA
"Keine EU-Steuern 32","No EU taxes 32",NA,NA
"Für ein Steuersystem mit wenigen Steuerarten und verständlicher Systematik 32","For a tax system with few tax types and understandable systematics 32",NA,NA
"Abschaffung der Substanzsteuern 33","Abolition of taxes on assets 33",NA,NA
"Wir wollen ein Land von Wohnungseigentümern werden 34","We want to become a country of apartment owners 34",NA,NA
"Elementare Steuergerechtigkeit statt Nominalwertprinzip und Ungleichbehandlung von Steuerbürgern 35","Elementary tax justice instead of nominal value principle and unequal treatment of tax citizens 35",NA,NA
"Besteuerung an Digitalzeitalter anpassen: Einführung einer Digitalsteuer 37","Adapt taxation to the digital age: Introduction of a digital tax 37",NA,NA
"Wirtschaft: Für einen „Blue Deal” 40","Economy: For a ""Blue Deal"" 40",NA,NA
"Wirtschafts- und Innovationspolitik für Deutschland 40","Economic and Innovation Policy for Germany 40",NA,NA
"Den Mittelstand entlasten 41","Relieving the burden on SMEs 41",NA,NA
"Politisch induzierte Belastungen aussetzen 41","Suspend politically induced burdens 41",NA,NA
"Technologieführerschaft mit „Blue Deal” 41","Technology leadership with ""Blue Deal"" 41",NA,NA
"Soziale Marktwirtschaft statt sozialistischer „Industriepolitik“ 43","Social market economy instead of socialist ""industrial policy"" 43",NA,NA
"Der Euro ist gescheitert 48","The euro has failed 48",NA,NA
"Deutschland muss aus dem untergehenden Euro-System austreten 48","Germany must leave the declining euro system 48",NA,NA
"Keine Schuldenaufnahme durch die EU, Hilfskredite nur auf nationaler Ebene 49","No borrowing by the EU, aid loans only at national level 49",NA,NA
"Zusätzliche Inflationierung durch überzogene Corona-Maßnahmen beenden 50","End additional inflation through excessive Corona measures 50",NA,NA
"EZB-Nullzinspolitik beenden 50","End ECB zero interest rate policy 50",NA,NA
"Wohlstand und sozialer Frieden in Europa durch Wiedereinführung nationaler Währungen 53","Prosperity and social peace in Europe through the reintroduction of national currencies 53",NA,NA
"Erhalt des Bargelds: Bargeld ist Freiheit und Schutz vor Enteignung und Totalüberwachung 54","Preservation of cash: Cash is freedom and protection against expropriation and total surveillance 54",NA,NA
"Target-2-Risiko beenden 55","End Target 2 risk 55",NA,NA
"Nationale Investitionen 56","National investments 56",NA,NA
"Absicherung gegen die Eurokrise, Geldsystem reformieren, deutsches Staatsgold vollständig zurück nach Deutschland 56","Hedge against the euro crisis, reform monetary system, German state gold completely back to Germany 56",NA,NA
"Außen- und Verteidigungspolitik 60","Foreign and defense policy 60",NA,NA
"Die Außenpolitik Deutschlands muss sich an deutschen Interessen ausrichten 60","Germany's foreign policy must be aligned with German interests 60",NA,NA
"Das Verhältnis zu wichtigen Staaten im Wandel der Geopolitik 62","The Relationship with Major States in Changing Geopolitics 62",NA,NA
"Wiederherstellung der Wehrfähigkeit Deutschlands 64","Restoration of Germany's military capability 64",NA,NA
"Entwicklungspolitik: Stabilität als Sicherheits- und Wirtschaftsinteresse 66","Development Policy: Stability as a Security and Economic Interest 66",NA,NA
"Deutschland muss seine wirtschaftlichen Stärken ausbauen 68","Germany must build on its economic strengths 68",NA,NA
"Auswärtige Kultur- und Bildungspolitik Deutschlands 69","Germany's foreign cultural and educational policy 69",NA,NA
"4 Inhaltsverzeichnis Inhaltsverzeichnis 5","4 Table of contents Table of contents 5",NA,NA
"Innere Sicherheit 74","Internal security 74",NA,NA
"Linke Gewalt entschieden bekämpfen 74","Decisively combating left-wing violence 74",NA,NA
"Wirksame Bekämpfung der Ausländerkriminalität 75","Effectively combating crime against foreigners 75",NA,NA
"Vollstreckung im Ausland 76","Enforcement abroad 76",NA,NA
"Jugendstrafrecht 76","Juvenile criminal law 76",NA,NA
"Bundespolizei stärken – Grenzschutz ist nationale Aufgabe 76","Strengthen federal police - border protection is a national task 76",NA,NA
"Reform der Polizei 77","Police reform 77",NA,NA
"Fahndungsmöglichkeiten verbessern 78","Improve tracing capabilities 78",NA,NA
"Organisierte Kriminalität bekämpfen 78","Combating organized crime 78",NA,NA
"Sicherheit der Bürger verbessern 79","Improve citizen safety 79",NA,NA
"Strafjustiz verbessern 79","Improve criminal justice 79",NA,NA
"Islam 82","Islam 82",NA,NA
"Migration, Asyl und Integration: Human und rational handeln – Deutschland schützen 88","Migration, asylum and integration: Acting humanely and rationally - protecting Germany 88",NA,NA
"Asylmissbrauch beenden 88","End asylum abuse 88",NA,NA
"Die unlösbaren Folgeprobleme 89","The unsolvable follow-up problems 89",NA,NA
"Asylparadies Deutschland schließen 90","Close asylum paradise Germany 90",NA,NA
"Abschiebung und Rückkehr 92","Deportation and return 92",NA,NA
"Leben retten und soziale Gerechtigkeit herstellen 94","Saving lives and achieving social justice 94",NA,NA
"Hilfe vor Ort statt Tod auf dem Weg nach Europa 95","Help on the spot instead of death on the way to Europe 95",NA,NA
"Zuwanderung wieder national regeln 95","Regulate immigration nationally again 95",NA,NA
"Qualifizierte Zuwanderung 96","Qualified immigration 96",NA,NA
"Integration 97","Integration 97",NA,NA
"Die deutsche Staatsangehörigkeit ist ein kostbares Gut 99","German citizenship is a precious commodity 99",NA,NA
"Familienpolitik 102","Family policy 102",NA,NA
"Familien stärken und fördern 102","Strengthening and promoting families 102",NA,NA
"Ursachen der demografischen Katastrophe 103","Causes of the demographic catastrophe 103",NA,NA
"Leistungsfähigkeit der Familien erhalten 104","Maintaining the performance of families 104",NA,NA
"Familien unterstützen 105","Support families 105",NA,NA
"Familienfreundliches Deutschland 106","Family-friendly Germany 106",NA,NA
"Kinder in den Familien belassen - Kindesentzug nur in Ausnahmen 107","Keep children in families - child removal only in exceptions 107",NA,NA
"Willkommenskultur für Kinder 108","Welcome culture for children 108",NA,NA
"Trennungsfolgen mindern 110","Mitigate separation consequences 110",NA,NA
"Verantwortungsvolle Kinderbetreuung 111","Responsible childcare 111",NA,NA
"Das Geschlecht ist eine biologische Tatsache 112","Gender is a biological fact 112",NA,NA
"Arbeits- und Sozialpolitik 116","Labor and social policy 116",NA,NA
"Zuwanderung von EU-Ausländern in unsere Sozialsysteme begrenzen 116","Limit immigration of EU foreigners into our social systems 116",NA,NA
"Nationale Gesetzgebungshoheit im Sozialrecht verteidigen 116","Defending National Legislative Sovereignty in Social Law 116",NA,NA
"Keine Auszahlungen von Sozialleistungen auf ausländische Konten 117","No disbursements of social benefits to foreign accounts 117",NA,NA
"Lohndumping in der Leiharbeit verhindern 117","Preventing wage dumping in temporary employment 117",NA,NA
"Mindestlohn beibehalten 117","Maintain minimum wage 117",NA,NA
"Arbeitsleben würdigen – Arbeitslosengeld I gerecht gestalten 118","Appreciating working life - making unemployment benefit I fair 118",NA,NA
"Reform der Arbeitslosenversicherung 118","Unemployment insurance reform 118",NA,NA
"Aktivierende Grundsicherung - Arbeit, die sich lohnt 119","Activating basic security - work that pays 119",NA,NA
"Finanzkontrolle Schwarzarbeit stärken 119","Strengthen financial control of undeclared work 119",NA,NA
"Arbeitsrecht reformieren und vereinfachen 120","Reform and simplify labor law 120",NA,NA
"Gezielte Maßnahmen gegen Wohnungs- und Obdachlosigkeit 120","Targeted measures against housing and homelessness 120",NA,NA
"Mehr Arbeitsplätze mit fairer Entlohnung für schwerbehinderte Menschen 120","More jobs with fair pay for severely disabled people 120",NA,NA
"Verbesserungen für Menschen mit Behinderungen in Krankenhäusern 121","Improvements for people with disabilities in hospitals 121",NA,NA
"Das Rentenkonzept der AfD 124","The AfD's pension concept 124",NA,NA
"Renten zukunftsfest 124","Future-proofing pensions 124",NA,NA
"Freiheit beim Renteneintritt 125","Freedom at retirement 125",NA,NA
"Altersarmut verhindern 125","Preventing poverty in old age 125",NA,NA
"Abschaffung der Politikerpensionen 126","Abolition of politicians' pensions 126",NA,NA
"Reduzierung des Beamtenstatus auf originär hoheitliche Aufgaben 126","Reduction of civil servant status to original sovereign tasks 126",NA,NA
"Lastengerechtigkeit zwischen Familien und Kinderlosen herstellen 127","Establish equity in burdens between families and the childless 127",NA,NA
"Ungerechtigkeiten bei der Überleitung der Ostrenten beseitigen 128","Eliminate inequities in the transition of eastern pensions 128",NA,NA
"Keine Doppelbesteuerung, Steuerfreibetrag anheben 128","No double taxation, raise tax allowance 128",NA,NA
"Umlagefinanzierte Rente stärken 129","Strengthen pay-as-you-go pension 129",NA,NA
"Wehrdienst rentenpolitisch würdigen 129","Appreciate military service in terms of pension policy 129",NA,NA
"6 Inhaltsverzeichnis Inhaltsverzeichnis 7","6 Table of contents Table of contents 7",NA,NA
"Gesundheitspolitik 132","Health policy 132",NA,NA
"Schluss mit den unverhältnismäßigen Corona-Maßnahmen 132","An end to disproportionate Corona measures 132",NA,NA
"Impfen muss freiwillig bleiben 133","Vaccination must remain voluntary 133",NA,NA
"Einsetzung eines parlamentarischen Corona-Untersuchungsausschusses 133","Establishment of a parliamentary Corona investigation committee 133",NA,NA
"Krankenhäuser und Kliniken brauchen Planungssicherheit und eine individuell auskömmliche Finanzierung 134","Hospitals and clinics need planning security and individually adequate funding 134",NA,NA
"Serviceorientierte ambulante Versorgung durch Beendigung der Budgetierung 135","Service-oriented outpatient care by ending budgeting 135",NA,NA
"Medizinische Versorgung auf dem Land wiederherstellen und sichern 136","Restore and secure medical care in rural areas 136",NA,NA
"Zugang zu Heil- und Hilfsmitteln entbürokratisieren 137","Reduce bureaucracy in access to therapeutic products and aids 137",NA,NA
"Kurzzeitpflegeplätze in Krankenhäusern finanzieren 137","Fund short-term care places in hospitals 137",NA,NA
"Beendigung des Pflegenotstands 137","Ending the nursing shortage 137",NA,NA
"Vorfahrt für die häusliche Pflege 138","Right of way for home care 138",NA,NA
"Vereinfachung und bessere Übersichtlichkeit in der sozialen Pflegeund gesetzlichen Krankenversicherung 139","Simplification and better clarity in social long-term care and statutory health insurance 139",NA,NA
"Arzneimittelversorgung verlässlich machen 139","Making drug supply reliable 139",NA,NA
"Organspende, Sterbehilfe 140","Organ donation, euthanasia 140",NA,NA
"Cannabis nur in der Medizin 140","Cannabis only in medicine 140",NA,NA
"Antibiotikaresistenzen vermeiden und konsequent begegnen 141","Avoiding and consistently countering antibiotic resistance 141",NA,NA
"Den Beruf des Heilpraktikers erhalten 141","Preserving the profession of alternative medicine 141",NA,NA
"Anforderungen an ausländisches Personal im Gesundheitswesen 142","Requirements for foreign personnel in the health care sector 142",NA,NA
"Souveränität des Patienten über seine Daten herstellen 142","Establish patient sovereignty over their data 142",NA,NA
"WHO grundlegend reformieren 143","Fundamentally reform the WHO 143",NA,NA
"Bildung, Wissenschaft und Forschung 146","Education, science and research 146",NA,NA
"Mut zur Leistung statt Akademisierungswahn 146","The courage to perform instead of the academization mania 146",NA,NA
"Mehrgliedriges Schulsystem erhalten 146","Maintaining a multi-tier school system 146",NA,NA
"Berufliche Bildung stärken: Meister statt Master 147","Strengthening vocational training: Master craftsman instead of master 147",NA,NA
"Digitalisierung ist kein Selbstzweck 147","Digitization is not an end in itself 147",NA,NA
"Keine ideologisch motivierte Inklusion: Förder- und Sonderschulen erhalten 148","No ideologically motivated inclusion: Preserve special schools 148",NA,NA
"Bildung und Migration 148","Education and migration 148",NA,NA
"Neutralität der Schule wiederherstellen 149","Restoring the neutrality of the school 149",NA,NA
"Kompetenzorientierung entwertet Bildung 149","Competence orientation devalues education 149",NA,NA
"Deutsches Kulturgut im Unterricht vermitteln 149","Teaching German cultural heritage in the classroom 149",NA,NA
"Kein bekenntnisgebundener Islamunterricht an deutschen Schulen 150","No denominational Islamic instruction in German schools 150",NA,NA
"Kein Koranunterricht durch verfassungsfeindliche Moscheevereine 150","No Koran lessons by anti-constitutional mosque associations 150",NA,NA
"Keine Konfuzius-Institute an öffentlichen Bildungseinrichtungen 151","No Confucius Institutes at Public Educational Institutions 151",NA,NA
"Bologna ist gescheitert: Diplom und Magister wieder einführen 151","Bologna has failed: reintroduce Diplom and Magister 151",NA,NA
"Autonomie der Hochschulen stärken, Freiheit von Forschung und Lehre bewahren 151","Strengthening the autonomy of universities, preserving freedom of research and teaching 151",NA,NA
"Kein Geld für „Gender Studies“, keine Gender-Quoten 152","No money for ""gender studies,"" no gender quotas 152",NA,NA
"Kultur 156","Culture 156",NA,NA
"Deutsche Leitkultur statt „Multikulturalismus“ 156","German Leitkultur instead of ""Multiculturalism"" 156",NA,NA
"Kulturförderung 157","Cultural promotion 157",NA,NA
"Brauchtum und Gedenken 158","Customs and commemoration 158",NA,NA
"Medien 162","Media 162",NA,NA
"Den öffentlich-rechtlichen Rundfunk neu gestalten 162","Redesigning Public Service Broadcasting 162",NA,NA
"„Cancel Culture“ bekämpfen 162","""Cancel Culture"" fight 162",NA,NA
"Meinungsfreiheit statt Tugendterror 163","Freedom of Expression Instead of Virtue Terror 163",NA,NA
"Bauen, Wohnen, Mieten 166","Building, living, renting 166",NA,NA
"Wohneigentumsförderung 167","Home ownership promotion 167",NA,NA
"Mehr Wohngeld statt sozialem Wohnungsbau 168","More housing subsidies instead of social housing 168",NA,NA
"Klima, Energie, Technik und Digitalisierung 172","Climate, energy, technology and digitization 172",NA,NA
"Dem Klimawandel positiv begegnen 172","Responding positively to climate change 172",NA,NA
"Kernforderungen zur Klimapolitik 173","Core demands on climate policy 173",NA,NA
"Technischen Fortschritt begrü.en 173","To welcome technical progress 173",NA,NA
"Energie – Nein zum „Green Deal” 174","Energy - No to the ""Green Deal"" 174",NA,NA
"Digitalisierung muss uns Menschen dienen 178","Digitization must serve us humans 178",NA,NA
"Datenschutz und Datensicherheit 180","Data protection and data security 180",NA,NA
"Infrastruktur ist die Grundlage für den weiteren Ausbau der Digitalisierung 181","Infrastructure is the basis for the further expansion of digitization 181",NA,NA
"Digitalisierung der öffentlichen Verwaltung 182","Digitization of public administration 182",NA,NA
"Digitale Souveränität 182","Digital sovereignty 182",NA,NA
"8 Inhaltsverzeichnis 9","8 Table of contents 9",NA,NA
"Verkehrspolitik 183","Transport policy 183",NA,NA
"Motorisierten Individualverkehr schützen 183","Protect motorized private transport 183",NA,NA
"Bundesautobahnen entlasten – Transitverkehr auf Schiene und Wasserwege verlagern 184","Relieve congestion on federal highways - shift transit traffic to rail and waterways 184",NA,NA
"Flugverkehr als Wirtschaftsfaktor stärken 185","Strengthening air traffic as an economic factor 185",NA,NA
"Die deutsche Automobilindustrie als Leitindustrie erhalten 185","Maintaining the German automotive industry as a leading industry 185",NA,NA
"Stadt und Land gleichrangig entwickeln 186","Develop urban and rural areas on an equal footing 186",NA,NA
"Landschaft als Teil regionaler Identität 187","Landscape as part of regional identity 187",NA,NA
"Infrastruktur 188","Infrastructure 188",NA,NA
"Kommunen stärken – Erfüllung der Pflichtaufgaben sicherstellen 188","Strengthening municipalities - ensuring fulfillment of mandatory tasks 188",NA,NA
"Ausbau digitaler Infrastrukturen beschleunigen 188","Accelerating the expansion of digital infrastructures 188",NA,NA
"Nord Stream 2 endlich fertigstellen 189","Finally complete Nord Stream 2 189",NA,NA
"Landwirtschaft, Umwelt- und Verbraucherschutz 192","Agriculture, environmental and consumer protection 192",NA,NA
"EU-Agrarpolitik renationalisieren 193","Renationalize EU agricultural policy 193",NA,NA
"Grüne Berufe wertschätzen 193","Valuing green professions 193",NA,NA
"Familienbetriebe in den Mittelpunkt stellen 194","Focus on family farms 194",NA,NA
"Düngung am Bedarf der Pflanze orientieren 194","Orient fertilization to the needs of the plant 194",NA,NA
"Tierwohl, Haltung und Transport weiterentwickeln 195","Further develop animal welfare, husbandry and transport 195",NA,NA
"Schutz der heimischen Ökosysteme verbessern 196","Improve protection of native ecosystems 196",NA,NA
"Zeitgemäßes Wildtiermanagement umsetzen 196","Implementing contemporary wildlife management 196",NA,NA
"Unsere Wälder schützen und bewahren 197","Protecting and preserving our forests 197",NA,NA
"Gesunde Lebensmittel aus heimischer Produktion fördern 198","Promote healthy food from local production 198",NA,NA
"Transparenz im Verbraucherschutz ausbauen 198","Expanding transparency in consumer protection 198",NA,NA
"Wasserversorgung in öffentlicher Hand belassen 199","Leave water supply in public hands 199",NA,NA
"Ausbau von erneuerbaren Energien einschränken 199","Restrict expansion of renewable energies 199",NA,NA
"Index 202","Index 202",NA,NA
"Demokratie und Rechtsstaat","Democracy and the rule of law","H",NA
"Das Volk ist der Souverän","The people are the sovereign","H",NA
"Die Regierungspolitiker in Bund und Ländern haben mit ihrer Flüchtlings-, Europa- und Corona-Politik die Prinzipien der deutschen Staatlichkeit, des Rechts und der Verfassung vielfach verletzt.","With their refugee, European and Corona policies, government politicians at the federal and state levels have in many cases violated the principles of German statehood, law and the constitution.","305.2",NA
"Zugleich haben sich die Volksvertreter der etablierten Parteien den grundgesetzlich garantierten Parlamentsvorbehalt für alle wichtigen Entscheidungen im Staat ohne Widerstand nehmen lassen.","At the same time, the representatives of the established parties have allowed themselves to be deprived of the parliamentary prerogative guaranteed by the Basic Law for all important decisions in the state without resistance.","202.1",NA
"Die Bundesregierung kommt ihrer Pflicht, Vertragsbrüchen und Selbstermächtigungen durch EU-Institutionen entgegenzutreten, nicht nach.","The German government is not fulfilling its duty to counter treaty violations and self-empowerment by EU institutions.","110",NA
"Einzelne rechts- und verfassungswidrige Maßnahmen wurden zwar durch mutige Richter in Hunderten von Urteilen zu Fall gebracht.","Individual unlawful and unconstitutional measures have been overturned by courageous judges in hundreds of rulings.","605.1",NA
"In unserem Land hat sich aber eine politische Klasse herausgebildet, deren vordringliches Interesse ihrer Macht, ihrem Status und ihrem materiellen Wohlergehen gilt.","In our country, however, a political class has emerged whose primary interest is its power, status and material well-being.","304",NA
"Diese setzt die soziale und kulturelle Zukunft unseres Volkes, die Stärke unserer Wirtschaft und damit unseres Wohlstandes aufs Spiel und stellt Multikulturalität, Diversität, Globalisierung und vermeintliche Gendergerechtigkeit über alles.","This puts the social and cultural future of our people, the strength of our economy and thus our prosperity at risk and puts multiculturalism, diversity, globalization and supposed gender justice above all else.","601.1",NA
"Sie hält die Schalthebel der staatlichen Macht, der politischen Bildung und des informationellen und medialen Einflusses auf die Bevölkerung in Händen.","It holds the levers of state power, political education and informational and media influence over the population.","304",NA
"Deshalb halten wir die unmittelbare Demokratie für ein unverzichtbares Mittel, um dem autoritären und teilweise totalitären Gebaren der Regierungspolitiker Einhalt zu gebieten.","That is why we consider direct democracy to be an indispensable means of putting a stop to the authoritarian and sometimes totalitarian behavior of government politicians.","202.4",NA
"Volksabstimmungen nach Schweizer Modell","Referendums based on the Swiss model","H",NA
"Die AfD fordert Volksentscheide nach Schweizer Modell auch für Deutschland.","The AfD is calling for referendums based on the Swiss model for Germany as well.","202.4",NA
"Die uneingeschränkte Volkssouveränität in ihrer fast 200 Jahre bewährten und optimierten Gestaltung hat dem eidgenössischen Bundesstaat eine fortwährende Spitzenstellung in Wohlstand, Frieden und Freiheit gewährleistet.","Unrestricted popular sovereignty, in its nearly 200 years of proven and optimized design, has ensured the federal state's continued leadership in prosperity, peace and freedom.","202.4",NA
"Durch die Volksabstimmungen wollen wir die Flut der oftmals unsinnigen Gesetzesvorlagen eindämmen und die Parlamente zu sorgfältiger Arbeit zwingen.","Through referendums, we want to stem the tide of often nonsensical bills and force parliaments to work carefully.","202.4",NA
"Unangemessenen Beschlüssen der Abgeordneten in eigener Sache wollen wir einen Riegel vorschieben.","We want to put a stop to inappropriate decisions by members of parliament on their own behalf.","304",NA
"Hierzu zählen etwa die Diäten, Fraktions- und Parteienfinanzierung sowie die Finanzierung von „parteinahen“ Stiftungen.","These include, for example, parliamentary allowances, parliamentary group and party financing, and the financing of ""party-affiliated"" foundations.","304",NA
"Der Wortbruch der etablierten Parteien bezüglich des Euros und die immer weitere Zentralisierung der EU bedrohen die Zukunft unseres Landes (sowie der nachfolgenden Generationen).","The reneging of the established parties regarding the Euro and the ever further centralization of the EU threaten the future of our country (as well as the generations to come).","110",NA
"Diese fatale Politik wollen wir beenden.","We want to put an end to this fatal policy.","110",NA
"Die Einführung von Volksabstimmungen nach Schweizer Modell ist für die AfD nicht verhandelbarer Inhalt jeglicher Koalitionsvereinbarungen und beinhaltet insbesondere folgende Elemente:","For the AfD, the introduction of referendums based on the Swiss model is a non-negotiable part of any coalition agreement and includes the following elements in particular:","202.4",NA
"Ohne Zustimmung des Volkes darf das Grundgesetz nicht geändert und kein bedeutsamer völkerrechtlicher Vertrag geschlossen werden.","The Basic Law may not be amended and no significant international treaty may be concluded without the consent of the people.","202.4",NA
"Wir wollen dem Volk das Recht geben, den Abgeordneten auf die Finger zu schauen und vom Parlament beschlossene Gesetze zu ändern oder abzulehnen.","We want to give the people the right to keep an eye on their representatives and to amend or reject laws passed by Parliament.","202.4",NA
