"text","text_en","cmp_code","eu_code"
"(2) keine Staatsfinanzierung durch die EZB,","2) no government financing by the ECB, (","110",NA
"(3) keine faktische Vergemeinschaftung der Schulden,","3) no de facto communitization of debt, (","110",NA
"(4) Beschränkung der EZB auf reine Geldpolitik,","4) restriction of the ECB to pure monetary policy,","110",NA
"(5) keine heimliche und hoch ideologische Wirtschaftspolitik über „Green Deal“ und Anleihekäufe und","(5) no secret and highly ideological economic policy via ""Green Deal"" and bond purchases, and","110",NA
"(6) Ende der Nullzins-Politik und der EZB-Anleihekaufprogramme.","(6) an end to the zero interest rate policy and the ECB bond purchase programs.","110",NA
"(7) Die Bundesbank wird aufgefordert, sich mit allen Mitteln bei der EZB dafür einzusetzen, um eine Änderung der Geschäftsordnung bei den Abstimmungsmodalitäten bzgl. Der Stimmrechte der Mitglieder des EZB-Rates bei geldpolitischen Entscheidungen herbeizuführen.","(7) The Bundesbank is called upon to use all means at the ECB to bring about a change in the rules of procedure regarding the voting rights of the members of the ECB Governing Council in monetary policy decisions.","110",NA
"Die Stimmrechte der Mitglieder des EZB-Rates haben sich am Anteil des haftenden Eigenkapitals der Mitgliedsstaaten zu orientieren.","The voting rights of the members of the Governing Council shall be based on the share of the liable equity capital of the member states.","110",NA
"Das bisher praktizierte Rotationsverfahren ist zu verwerfen.","The rotation procedure practiced to date should be discarded.","110",NA
"Wohlstand und sozialer Frieden in Europa durch Wiedereinführung nationaler Währungen","Prosperity and social peace in Europe through the reintroduction of national currencies","H",NA
"Der Euro ist für ein Wirtschaftsgebiet mit derzeit 19 sehr unterschiedlich leistungsfähigen Volkswirtschaften eine Fehlkonstruktion und kann in dieser Form weder ökonomisch noch sozial funktionieren.","The euro is a misconstruction for an economic area with currently 19 very differently performing economies and cannot function in this form, neither economically nor socially.","110",NA
"Die Arbeitslosigkeit ist seit Jahren im Süden Europas erschreckend hoch als Folge der fehlenden bzw. verloren gegangenen Wettbewerbsfähigkeit dieser Länder innerhalb des Euro- Korsetts.","Unemployment has been alarmingly high in southern Europe for years as a result of the lack or loss of competitiveness of these countries within the euro corset.","110",NA
"Auch die soziale Euro-Krise ist ein systemisches Problem.","The social euro crisis is also a systemic problem.","110",NA
"Die Lösung besteht in der Wiedereinführung der nationalen Währungen, in denen sich die Leistungen der jeweiligen Volkswirtschaften widerspiegeln.","The solution is to reintroduce national currencies that reflect the performance of the respective economies.","109",NA
"Durch nationale Währungen wird jeder Staat wieder für seine Wirtschafts-, Währungs- und Finanzpolitik verantwortlich und erhält damit seine politische Souveränität zurück.","Through national currencies, each state becomes responsible again for its economic, monetary and fiscal policy and thus regains its political sovereignty.","109",NA
"Damit werden auch die internen Konflikte in der Euro-Zone gelöst:","This will also resolve the internal conflicts in the euro zone:","110",NA
"Keinem früheren Euroland müssen danach noch strenge Vorgaben gemacht werden, um seine im Euro-Korsett verloren gegangene Wettbewerbsfähigkeit wiederherzustellen.","No former eurozone country will then have to be subject to strict requirements in order to restore the competitiveness it has lost in the euro corset.","110",NA
"Die Staaten können ihre Wettbewerbsfähigkeit dann wieder, wie vor der Euro-Einführung, durch eigene Entscheidung über die Veränderung des Wechselkurses wiederherstellen.","The states can then restore their competitiveness, as they did before the introduction of the euro, by deciding on their own to change the exchange rate.","110",NA
"Die wiedereingeführte Deutsche Mark würde ihre hohe Kaufkraft gegenüber den anderen Ländern analog zur hohen Leistungsfähigkeit der deutschen Wirtschaft wiedergewinnen.","The reintroduced German mark would regain its high purchasing power vis-à-vis other countries in line with the high performance of the German economy.","109",NA
"Die Senkung der Importpreise würde zu steigenden Realeinkommen führen, die der gesamten deutschen Volkswirtschaft zugute kämen und nicht nur, wie derzeit, einigen Exportfirmen.","Lowering import prices would lead to rising real incomes, which would benefit the entire German economy and not just a few export firms, as is currently the case.","410",NA
"Der ehemalige Bundeswirtschafts- und Finanzminister Schiller hatte dies einst so formuliert: „Jede Währungsaufwertung ist eine Sozial-Dividende für das deutsche Volk, denn ihr könnt danach im Supermarkt alles billiger kaufen“.","The former Federal Minister of Economics and Finance, Schiller, once put it this way: ""Every currency revaluation is a social dividend for the German people, because you can buy everything cheaper in the supermarket afterwards"".","412",NA
"Der AfD ist bewusst, dass die Wiedereinführung der nationalen Währung nicht ohne Umstellungsbelastungen erfolgen kann.","The AfD is aware that the reintroduction of the national currency cannot take place without conversion burdens.","107",NA
"Diese werden jedoch niedriger sein als die Kosten des weiteren Verbleibs im Eurosystem.","However, these will be lower than the costs of remaining in the Eurosystem.","110",NA
"Erhalt des Bargelds: Bargeld ist Freiheit und Schutz vor Enteignung und Totalüberwachung","Preservation of cash: Cash is freedom and protection against expropriation and total surveillance","H",NA
"Unser Bargeld ist in Gefahr.","Our cash is in danger.","201.1",NA
"Mit Unterstützung von Bundesregierung, IWF und EZB wird die Abschaffung des Bargelds vorbereitet.","With the support of the German government, the IMF and the ECB, the abolition of cash is being prepared.","201.1",NA
"Mit dessen Abschaffung würde die Rolle des Geldes als gebührenfreiem Wertspeicher eingeschränkt.","Its abolition would limit the role of money as a non-fee store of value.","201.1",NA
"Eine Abschaffung des Bargeldes macht im Krisenfall die Enteignung von Kontoinhabern möglich.","Abolishing cash makes it possible to expropriate account holders in the event of a crisis.","201.1",NA
"Bargeld ist ein natürliches Bollwerk gegen enteignende Negativzinsen.","Cash is a natural bulwark against expropriating negative interest rates.","201.1",NA
"Ein Bargeldverbot würde bedeuten, dass Zahlungsvorgänge nur noch elektronisch stattfinden können.","A cash ban would mean that payment transactions could only take place electronically.","201.1",NA
"Dies eröffnet dem Staat und Banken die totale Kontrolle über alle Geldströme und Wirtschaftsaktivitäten, über alle Finanztransaktionen, unter Umständen sogar über Aufenthaltsorte aller Bürger.","This gives the state and banks total control over all money flows and economic activities, over all financial transactions, and possibly even over the whereabouts of all citizens.","201.1",NA
"Aus dem gläsernen Bankkunden würde der gläserne Mensch – Vollüberwachung bis in private, ja intime Lebensbereiche.","The transparent bank customer would become the transparent human being - full surveillance right into private, even intimate areas of life.","201.1",NA
"Mit einem freiheitlichen Rechtsstaat sind solche Kontrollmöglichkeiten nicht vereinbar.","Such control options are not compatible with a liberal constitutional state.","201.1",NA
"Die AfD fordert den dauerhaften Erhalt der uneingeschränkten Bargeldnutzung als wichtigem bürgerlichen Freiheitsrecht und seine Verankerung im Grundgesetz.","The AfD calls for the permanent preservation of unrestricted cash use as an important civil liberty right and its anchoring in the Basic Law.","201.1",NA
"Die AfD spricht sich auch gegen von Zentralbanken herausgegebene digitale Währungen aus, die ein Einfallstor für die schleichende Abschaffung des Bargeldes wären.","The AfD also opposes digital currencies issued by central banks, which would be a gateway for the creeping abolition of cash.","201.1",NA
"Die Verfügbarkeit und Wertaufbewahrungsfunktion des Bargeldes muss erhalten bleiben.","The availability and store-of-value function of cash must be preserved.","201.1",NA
"Target-2-Risiko beenden","End Target 2 risk","H",NA
"Auf der Aktivseite der Bundesbankbilanz belaufen sich die Überziehungskredite einzelner Notenbanken der Euro-Staaten (Target-2-Forderungen der Gläubigerstaaten) auf über eine Billion Euro.","On the assets side of the Bundesbank's balance sheet, the overdrafts of individual central banks of the euro area countries (Target 2 claims of creditor states) amount to more than one trillion euros.","110",NA
"Diese Forderungen der Deutschen Bundesbank sind unbesicherte, derzeit unverzinste, nicht fällig stellbare Forderungen.","These receivables of Deutsche Bundesbank are unsecured, currently non-interest-bearing, non-maturity-bearing receivables.","110",NA
"Ihre Beitreibung ist mangels Sicherheiten ungewiss.","Their recovery is uncertain due to a lack of collateral.","110",NA
"Es gibt eine Reihe wahrscheinlicher Szenarien für eine Ausbuchung dieser Beträge.","There are a number of likely scenarios for derecognition of these amounts.","110",NA
"Target-2- Wertverluste stellen ein hohes Milliarden-Risiko für den Bundeshaushalt und damit für den deutschen Steuerzahler dar.","Target 2 losses in value represent a high risk worth billions for the federal budget and thus for the German taxpayer.","110",NA
"Sicher ist, dass die EZB als Anspruchsgegner der Bundesbank im Falle einer (Teil-)Auflösung der Eurozone die deutschen Target-Forderungen nur noch in abgewerteten Euros oder gar nicht mehr zurückzahlen wird.","What is certain is that, in the event of a (partial) dissolution of the euro area, the ECB, as the Bundesbank's counterparty, will repay the German Target claims only in devalued euros or not at all.","110",NA
"Wegen der substanzlosen Target- Forderungen kommen die noch immer sehr hohen deutschen Au.enhandelsüberschüsse innerhalb der Eurozone der deutschen Volkswirtschaft kaum noch zugute.","Because of the insubstantial Target claims, the still very high German foreign trade surpluses within the euro area hardly benefit the German economy.","110",NA
"Als Sofortmaßnahme fordert die AfD darum die Bundesregierung und die Deutsche Bundesbank auf, die bislang geduldete Überbeanspruchung des Verrechnungskontos „Target-2“ zu unterbinden.","As an immediate measure, the AfD therefore calls on the German government and the Deutsche Bundesbank to stop the overuse of the ""Target-2"" clearing account, which has been tolerated up to now.","110",NA
"Die Target-2-Forderungen der Deutschen Bundesbank sind abzuschmelzen, täglich auszugleichen, angemessen zu verzinsen und mit Sicherheiten zu unterlegen.","The Deutsche Bundesbank's Target 2 claims are to be reduced, settled daily, subject to appropriate interest and backed by collateral.","110",NA
"Die AfD ist auch offen für weitere sinnvolle Vorschläge, die Target-Forderungen zu „monetarisieren“ bzw. nutzbar zu machen.","The AfD is also open to other sensible proposals to ""monetize"" or harness the Target claims.","110",NA
"So könnte die Bundesbank z. B. ihre Target-Forderungen am Kapitalmarkt an Investoren weiterverkaufen und die erhaltenen Mittel in ausländischen Aktien, ausländischem Gold oder anderen Sachwerte anlegen.","For example, the Bundesbank could resell its Target claims to investors on the capital market and invest the funds received in foreign shares, foreign gold or other tangible assets.","110",NA
"Nationale Investitionen","National investments","H",NA
"Solange der Euro zu Lasten Deutschlands weiterbesteht, kann und sollte auch Deutschland einen großen Teil seines Refinanzierungsbedarfs über die EZB und die EU abwickeln.","As long as the euro continues to exist at Germany's expense, Germany can and should also handle a large part of its refinancing needs via the ECB and the EU.","110",NA
"Notprogramm-Mittel sind strikt für Hilfen und Investitionen in Deutschland einzusetzen und wo immer möglich über EU oder EZB zu finanzieren.","Emergency program funds must be used strictly for aid and investment in Germany and, wherever possible, financed via the EU or the ECB.","108",NA
"Auch der deutsche Target-Forderungssaldo sollte dafür mobilisiert werden.","The German Target claim balance should also be mobilized for this purpose.","108",NA
"Absicherung gegen die Eurokrise, Geldsystem reformieren, deutsches Staatsgold vollständig zurück nach Deutschland","Hedge against the euro crisis, reform monetary system, German state gold completely back to Germany","H",NA
"Deutschland muss auch in einem plötzlichen währungspolitischen Krisenfall handlungsfähig sein.","Germany must also be able to act in the event of a sudden monetary crisis.","414",NA
"Bei einer Wiedereinführung der Deutschen Mark könnte das teilweise im Ausland gelagerte Staatsgold als temporäre Deckungsoption dienen.","If the German mark is reintroduced, the state gold partially stored abroad could serve as a temporary cover option.","414",NA
"Gold ist nach aller historischer Erfahrung eine potenzielle Deckung für eine neue Währung, was besonders in Krisensituationen bzw. nach Einführung einer neuen Währung zum Vertrauensaufbau relevant wird.","According to all historical experience, gold is a potential cover for a new currency, which becomes particularly relevant in crisis situations or after the introduction of a new currency to build confidence.","414",NA
"Staatsgold muss ohne Gegenparteien- oder Verwahrrisiko im eigenen Land aufbewahrt werden.","Sovereign gold must be held in its own country without counterparty or custodial risk.","414",NA
"Die AfD fordert die Deutsche Bundesbank auf, das im Ausland gelagerte Staatsgold vollständig und umgehend nach Deutschland zu überführen.","The AfD calls on the German Bundesbank to transfer the state gold stored abroad completely and immediately to Germany.","414",NA
"Zudem fordert die AfD die Herbeiführung eines verfassungsrechtlich abzusichernden bilanziellen Sonderstatus der Goldreserve zur Abwehr der Ausbuchungsgefahr aufgrund der sich seit 2007 dramatisch verschlechternden Qualität der Bundesbank-Bilanz.","In addition, the AfD calls for the creation of a special balance sheet status for the gold reserve to be secured under constitutional law in order to avert the risk of derecognition due to the dramatic deterioration in the quality of the Bundesbank's balance sheet since 2007.","414",NA
"Langfristig halten wir eine grundsätzliche Reform des Geldsystems für notwendig, hin zu einem freien Währungswettbewerb oder einem goldgedeckten Währungssystem.","In the long term, we believe that a fundamental reform of the monetary system is necessary, toward free currency competition or a gold-backed monetary system.","414",NA
"Außen- und Verteidigungspolitik","Foreign and defense policy","H",NA
"Die Außenpolitik Deutschlands muss sich an deutschen Interessen ausrichten","Germany's foreign policy must be aligned with German interests","H",NA
"Deutschland ist als eine der bedeutenden Wirtschaftsund Kulturnationen der Welt daran interessiert, zu allen Staaten gute Beziehungen zu pflegen","As one of the most important economic and cultural nations in the world, Germany is interested in maintaining good relations with all countries","107",NA
"und das friedliche Zusammenleben der Völker zu fördern.","and to promote the peaceful coexistence of peoples.","106",NA
"Die AfD bekennt sich zu den Werten der Charta der Vereinten Nationen und des Völkerrechts.","The AfD is committed to the values of the United Nations Charter and international law.","201.2",NA
"Insbesondere das Selbstbestimmungsrecht der Völker darf nicht durch die Agenden zwischenstaatlicher Organisationen, von NGOs und durch den Machtzuwachs großer, global agierender Konzerne ausgehöhlt werden.","In particular, the right of peoples to self-determination must not be undermined by the agendas of intergovernmental organizations, NGOs, and the rise to power of large, global corporations.","109",NA
"Die internationalen Beziehungen befinden sich im Umbruch hin zu einer multipolaren Weltordnung.","International relations are undergoing a transformation toward a multipolar world order.","104",NA
"Sicherheitspolitisch ist dabei langfristig die Erlangung strategischer Autonomie für Deutschland und seine europäischen Partner anzustreben.","In terms of security policy, the long-term goal is to achieve strategic autonomy for Germany and its European partners.","104",NA
"In diesem Rahmen muss Deutschland seine Rolle in Europa verantwortungsbewusst wahrnehmen.","Within this framework, Germany must play its role in Europe responsibly.","108",NA
"Die Vergemeinschaftung der europäischen Außen- und Sicherheitspolitik (GASP) und den europäischen Auswärtigen Dienst lehnt die AfD ab.","The AfD rejects the communitarization of European foreign and security policy (CFSP) and the European External Action Service.","110",NA
"Eine stabile europäische Friedensordnung bedarf einer ausgewogenen Zusammenarbeit sowohl mit den USA als auch mit Russland.","A stable European peace order requires balanced cooperation with both the United States and Russia.","107",NA
"Dabei sind die legitimen Sicherheitsinteressen aller europäischen Staaten zu berücksichtigen.","The legitimate security interests of all European states must be taken into account.","104",NA
"Auch die Vereinten Nationen sind so zu reformieren, dass den veränderten Gewichtungen in der Welt Rechnung getragen wird.","The United Nations must also be reformed to take account of the changed weightings in the world.","601.1",NA
"Wir streben einen ständigen Sitz Deutschlands im Sicherheitsrat sowie die Abschaffung der gegen Deutschland gerichteten Feindstaatenklausel in der Charta der Vereinten Nationen an","We seek a permanent seat for Germany in the Security Council as well as the abolition of the enemy state clause in the United Nations Charter directed against Germany,","601.1",NA
"und wollen den UN-Migrationspakt (Global Compact for Migration) aufkündigen.","and we want to denounce the UN migration pact (Global Compact for Migration).","109",NA
"Die AfD fordert eine strikte Einhaltung des Nichteinmischungsgebots in innere Angelegenheiten von Staaten, auch durch nichtstaatliche Akteure.","The AfD calls for strict adherence to the principle of non-interference in the internal affairs of states, including by non-state actors.","109",NA
"Die Rolle der OSZE bei der Stabilisierung von Krisenregionen in Europa und seiner Peripherie hat sich dank des Konsensprinzips bewährt und muss ausgebaut werden.","The OSCE's role in stabilizing crisis regions in Europe and its periphery has proven its worth thanks to the consensus principle and must be expanded.","107",NA
"Wir setzen uns nachdrücklich für die Stärkung und Erweiterung der Kontrollmechanismen in der nuklearen und konventionellen Rüstung ein","We are strongly committed to strengthening and expanding nuclear and conventional arms control mechanisms","104",NA
"sowie für die Neuverhandlung kürzlich ausgesetzter Verträge (INF, Open Skies).","and to renegotiating recently suspended treaties (INF, Open Skies).","104",NA
"Der islamistische Terrorismus stellt weiterhin eine ernste Bedrohung der internationalen Staatengemeinschaft dar.","Islamist terrorism continues to pose a serious threat to the international community.","104",NA
"Er muss mit allen zur Verfügung stehenden legalen Mitteln bekämpft werden.","It must be fought with all legal means available.","104",NA
"Das Verhältnis zu wichtigen Staaten im Wandel der Geopolitik","The relationship with important states in the change of geopolitics","H",NA
"Die Mitgliedschaft in der NATO und eine aktive Rolle Deutschlands in der OSZE sind bis auf Weiteres zentrale Elemente unserer Sicherheitsstrategie.","Membership in NATO and an active role for Germany in the OSCE are central elements of our security strategy for the time being.","104",NA
"Die NATO muss aber wieder ein reines Verteidigungsbündnis werden.","But NATO must once again become a purely defensive alliance.","104",NA
"Die AfD tritt dafür ein, das Einsatzgebiet der NATO auf das Gebiet der Bündnisstaaten zu begrenzen.","The AfD advocates limiting NATO's area of operations to the territory of the alliance countries.","105",NA
"Die USA sind derzeit der stärkste Bündnispartner Deutschlands.","The USA is currently Germany's strongest ally.","107",NA
"Leitbild der Beziehungen zwischen unseren Ländern muss die Gleichberechtigung beider Partner sein.","The guiding principle of relations between our countries must be the equality of both partners.","107",NA
"Sanktionsmaßnahmen der USA gegen Deutschland sind nicht hinnehmbar.","Sanction measures by the USA against Germany are unacceptable.","107",NA
"Im Einklang mit den US-Forderungen nach einer gerechten Verteilung der Lasten und den europäischen Bestrebungen nach mehr Mitsprache in der NATO ist es nur folgerichtig und im deutschen Interesse, die europäische Säule der NATO zu stärken.","In line with U.S. demands for equitable burden sharing and European aspirations for a greater say in NATO, it is only logical and in Germany's interest to strengthen the European pillar of NATO.","104",NA
"Eine Entspannung im Verhältnis zu Russland ist Voraussetzung für einen dauerhaften Frieden in Europa.","Détente in relations with Russia is a prerequisite for lasting peace in Europe.","106",NA
"Es liegt im deutschen und europäischen Interesse, Russland in eine sicherheitspolitische Gesamtstruktur einzubinden.","It is in the German and European interest to integrate Russia into an overall security structure.","104",NA
"Wir setzen uns für die Wiederaufnahme regelmäßiger Gespräche im Rahmen des NATO-Russland-Rats ein.","We advocate the resumption of regular talks within the framework of the NATO-Russia Council.","104",NA
"Ferner sollen die Erweiterung und Vertiefung der vertrauens- und sicherheitsbildenden Maßnahmen,","Furthermore, the expansion and deepening of confidence- and security-building measures,","104",NA
"die Kooperation im Bereich der Rüstungskontrolle","cooperation in the field of arms control","104",NA
"und der Verzicht auf den Ausbau militärischer Infrastruktur in unmittelbarer Nähe der jeweiligen Interessenbereiche der Entspannung dienen.","and the renunciation of the expansion of military infrastructure in the immediate vicinity of the respective areas of interest serve to ease tensions.","105",NA
"Die AfD tritt für die Aufhebung der EU-Sanktionen","The AfD advocates the lifting of EU sanctions","107",NA
"und den Ausbau der Wirtschaftsbeziehungen zu Russland ein.","and the expansion of economic relations with Russia.","107",NA
"Die Fertigstellung und Inbetriebnahme der Gasleitung Nord Stream 2 halten wir für unverzichtbar.","We consider the completion and commissioning of the Nord Stream 2 gas pipeline to be indispensable.","107",NA
"Die Volksrepublik China gewinnt für Deutschland vor allem als Handelspartner an Bedeutung.","The People's Republic of China is gaining in importance for Germany, above all as a trading partner.","107",NA
"Mit dem Projekt der „Neuen Seidenstraße“ hat China ein Jahrhundertvorhaben gestartet.","With the ""New Silk Road"" project, China has launched a project of the century.","107",NA
"Um hier mitgestalten zu können, setzt sich die AfD für eine offensive Beteiligung Deutschlands an dem Projekt ein.","In order to be able to play a role here, the AfD is advocating Germany's proactive participation in the project.","411",NA
"Die chinesische Seidenstraßen- Strategie von Ost nach West sollte Deutschland durch eine Initiative von West nach Ost ergänzen.","The Chinese Silk Road strategy from East to West should be complemented by Germany with an initiative from West to East.","411",NA
"Das gilt insbesondere für überregionale Infrastrukturprojekte.","This applies in particular to supraregional infrastructure projects.","107",NA
"Die zunehmende Einflussnahme Chinas in der Welt ist eine Herausforderung.","China's increasing influence in the world is a challenge.","107",NA
"Eine Kooperation mit China darf nur unter Bedingungen der Gleichberechtigung und Fairness erfolgen.","Cooperation with China may only take place under conditions of equality and fairness.","107",NA
"Das setzt insbesondere eine Angleichung der rechtlichen Rahmenbedingungen für Handel und Investitionen voraus.","This requires in particular an alignment of the legal framework for trade and investment.","107",NA
"Ein weiterer Ausverkauf deutscher bzw. europäischer Technologie muss verhindert werden.","A further sell-out of German and European technology must be prevented.","406",NA
"Großbritannien wird auch nach dem Brexit wirtschaftlich eng mit Europa verflochten bleiben.","The UK will remain closely intertwined economically with Europe after Brexit.","107",NA
"Die AfD befürwortet daher die Pflege enger Beziehungen zum Vereinigten Königreich.","The AfD is therefore in favor of maintaining close relations with the United Kingdom.","107",NA
"Mögliche Blockaden und Strafmaßnahmen seitens der EU lehnen wir ab.","We reject possible blockades and punitive measures on the part of the EU.","107",NA
