"text","text_en","cmp_code","eu_code"
"Eine Fortsetzung der herrschenden, familienzersetzenden Politik wird die demografische Katastrophe, in die wir greaten sind, weiter verschlimmern.","A continuation of the prevailing, family-destroying policies will further exacerbate the demographic disaster into which we have stumbled.","603",NA
"Am Ende dieses Prozesses steht auch der Zusammenbruch der sozialen Sicherungssysteme","At the end of this process, there is also the collapse of social security systems","504",NA
"und letztlich unserer kulturellen Identität.","and ultimately of our cultural identity.","601.1",NA
"Das können wir nicht wollen!","We can't want that!","603",NA
"Die AfD ist entschlossen, dem familienfeindlichen Zeitgeist eine positive, familienfreundliche Sozialpolitik entgegenzustellen.","The AfD is determined to counter the anti-family zeitgeist with a positive, family-friendly social policy.","603",NA
"Ein Schlüssel zu glücklicheren und stabileren Familien liegt dabei in aktivierenden familienpolitischen Maßnahmen und in einer größeren Wertschätzung der Familienarbeit.","One key to happier and more stable families lies in activating family policy measures and in a greater appreciation of family work.","603",NA
"Ursachen der demografischen Katastrophe","Causes of the demographic catastrophe","H",NA
"Die Geburtenrate liegt in Deutschland seit Mitte der 70er Jahre weit unterhalb des Niveaus zur Bestandserhaltung.","Since the mid-1970s, the birth rate in Germany has been far below the level needed to maintain the population.","603",NA
"Bei einer Geburtenrate von 1,5 Kindern schrumpft ein Volk um ca. 30% pro Generation.","With a birth rate of 1.5 children, a nation shrinks by about 30% per generation.","603",NA
"Die Ursachen für den Geburtenrückgang sind vielfältig.","There are many reasons for the decline in births.","603",NA
"Durch den Ausbau des deutschen Sozialstaates mit Hilfeleistungen für alle Lebenslagen hat sich eine fundamental veränderte Einstellung der Bürger zum eigenen generativen Verhalten entwickelt.","The expansion of the German welfare state, which provides assistance for all situations in life, has led to a fundamental change in citizens' attitudes toward their own generative behavior.","603",NA
"Die Wahrnehmung des Staates als Helfer in allen Lebenslagen hat die Vorstellung von der eigenen Familie auch als generationsübergreifende Wirtschafts- und Versorgungsgemeinschaft ersetzt.","The perception of the state as a helper in all situations in life has replaced the idea of one's own family also as an intergenerational economic and care community.","603",NA
"Vor diesem Hintergrund wurde der Hang zur vorrangigen ökonomischen Wohlstandsoptimierung während der Lebenserwerbsphase zum Leitbild einer materialistischen Gesellschaft.","Against this background, the tendency to prioritize economic wealth optimization during the life-earning phase became the guiding principle of a materialistic society.","603",NA
"Immer mehr Paare haben daher den ideellen Wert einer Familie als Sozialisationsraum und emotionale intergenerative Lebensgemeinschaft aus den Augen verloren.","More and more couples have therefore lost sight of the ideal value of a family as a socialization space and emotional intergenerational living community.","603",NA
"Der Gedanke einer vorrangigen „Selbstverwirklichung” hat dazu geführt, zugunsten von Einkommen und Karriere Kinderwünsche zurückzustellen oder gänzlich aus der eigenen Lebensplanung zu verdrängen.","The idea of ""self-fulfillment"" as a priority has led to the desire for children being put on the back burner in favor of income and career, or being pushed out of one's life planning altogether.","603",NA
"Eltern, die für Familienarbeit ganz oder teilweise zu Hause bleiben, werden in unserer Gesellschaft abgewertet.","Parents who stay at home for all or part of family work are devalued in our society.","603",NA
"Insbesondere bei doppelberufstätigen Eltern besteht durch die strukturelle Benachteiligung von Familien in der Arbeitswelt eine mangelnde Vereinbarkeit von Familie und Beruf.","Particularly in the case of dual-working parents, there is a lack of compatibility between family and career due to the structural disadvantage of families in the world of work.","603",NA
"Hinzu kommen die kinderbezogenen Mehrkosten für Wohnraum, Versorgung und Ausbildung, die bei der Bemessung von Steuern und Sozialversicherungen nur minimal ausgeglichen werden.","In addition, there are the additional child-related costs of housing, utilities, and education, which are only minimally compensated for in the assessment of taxes and social insurance.","603",NA
"Das alles führt zu durchschnittlich kleineren Familien und teilweise auch zu einer gewollten Kinderlosigkeit.","All of this leads to smaller families on average and, in some cases, to intentional childlessness.","603",NA
"Leistungsfähigkeit der Familien erhalten","Preserve the performance of families","H",NA
"Vor allem Familien der mittleren Einkommensschicht werden in Deutschland steuerlich stärker belastet als in fast allen anderen europäischen Ländern.","Middle-income families in particular face a heavier tax burden in Germany than in almost all other European countries.","603",NA
"Die Geburtenrate ist bei diesen Familien erschreckend gering.","The birth rate among these families is alarmingly low.","603",NA
"Die AfD will hier mit dem steuerlichen Familiensplitting einen Paradigmenwechsel einleiten,","The AfD wants to introduce a paradigm shift here with family tax splitting,","603",NA
"verbunden mit einer Anhebung des Kinderfreibetrages.","combined with an increase in the child allowance.","603",NA
"Als weitere steuerliche Maßnahmen fordern wir die vollständige steuerliche Absetzbarkeit von kinderbezogenen Ausgaben","As further tax measures, we call for full tax deductibility of child-related expenses","603",NA
"und eine Absenkung der Mehrwertsteuer für Artikel des Kinderbedarfs auf den reduzierten Satz.","and a reduction of the value-added tax on items of children's needs to the reduced rate.","603",NA
"Ergänzend sollen Eltern zur Herstellung der Lastengerechtigkeit bei der Geburt jedes Kindes eine Rückzahlung bereits entrichteter Rentenbeiträge in Höhe von 20.000 € erhalten bzw. von zukünftigen Beiträgen in entsprechender Höhe freigestellt werden, ohne dass die spätere Leistung gekürzt wird.","In addition, in order to establish equity of burden, parents should receive a refund of pension contributions already paid in the amount of €20,000 at the birth of each child or be exempted from future contributions in the corresponding amount, without the subsequent benefit being reduced.","603",NA
"Familien unterstützen","Support families","H",NA
"Umfragen belegen immer wieder, dass sich viele junge Eltern in Deutschland statt Mehrfachbelastung und Rollenkonflikten mehr Zeit für ihre Kinder wünschen.","Surveys repeatedly show that many young parents in Germany would like more time for their children instead of multiple burdens and role conflicts.","603",NA
"Kinder unter drei Jahren fühlen sich am wohlsten, wenn sie durch die eigenen Eltern betreut werden.","Children under the age of three feel most comfortable when they are cared for by their own parents.","603",NA
"Es muss wieder möglich sein, dass eine Familie mit kleinen Kindern von einem Gehalt leben kann, so dass die Eltern frei zwischen Berufstätigkeit oder Erwerbspause entscheiden können.","It must once again be possible for a family with small children to live on one salary, so that parents are free to choose between working or taking a break from work.","603",NA
"Eltern, die ihre Kleinkinder selbst betreuen, erleben deren Entwicklung unmittelbar, vermitteln ihnen Herzensbildung und erhalten damit ihre körperliche und seelische Gesundheit, während gerade bei Kindern unter drei Jahren eine Fremdbetreuung mit Entwicklungsrisiken verbunden ist (Großstudie „The NICHD Study of Early Child Care and Youth Development“, 1991 und 2007).","Parents who care for their young children themselves experience their development directly, provide them with heart education and thus maintain their physical and mental health, while outside care is associated with developmental risks, especially for children under three years of age (major study ""The NICHD Study of Early Child Care and Youth Development,"" 1991 and 2007).","603",NA
"Die AfD will daher für die ersten drei Jahre ein Betreuungsgeld für Eltern bzw. Großeltern einführen, welches sich als Lohnersatzleistung am bisherigen durchschnittlichen Nettolohn der letzten drei Jahre vor Geburt des ersten Kindes orientiert, gedeckelt auf die Höhe des allgemeinen durchschnittlichen Nettogehalts.","The AfD therefore wants to introduce a childcare allowance for parents or grandparents for the first three years, which is based on the average net salary of the last three years before the birth of the first child, capped at the level of the general average net salary.","504",NA
"Das Kindergeld soll beibehalten,","Child benefits are to be retained,","504",NA
"Missbrauchsmöglichkeiten müssen aber unterbunden werden.","but opportunities for abuse must be prevented.","605.1",NA
"So ist zum Beispiel für im Ausland lebende Kinder nur der dort übliche Betrag zu zahlen.","For example, for children living abroad, only the amount customary there is payable.","505",NA
"Für junge Familien sollen die Erstanschaffungen bei Familiengründung durch einen Ehe-Start-Kredit un terstützt werden.","For young families, initial purchases when starting a family are to be supported by a marriage start-up loan.","504",NA
"Der Ehe-Startkredit soll Deutschen im Sinne des Grundgesetzes gewährt werden sowie EU-Bürgern, die seit mindestens 20 Jahren in Deutschland leben.","The marriage start-up loan is to be granted to Germans as defined by the Basic Law and to EU citizens who have lived in Germany for at least 20 years.","603",NA
"Mit jedem Kind wird ein Teil des Kredits erlassen.","With each child, a portion of the credit is forgiven.","603",NA
"BAföG-Empfängern soll bei einer Geburt während der Ausbildung bzw. während des Studiums die Rückzahlung bei erfolgreichem Abschluss erlassen werden.","BAföG recipients should be exempt from repayment upon successful completion in the event of a birth during training or during studies.","603",NA
"Für alle Studenten mit Kindern soll die Regelstudienzeit auf Antrag um bis zu sechs Semester verlängert werden.","For all students with children, the standard period of study is to be extended by up to six semesters upon request.","603",NA
"Der Wiedereinstieg von Eltern nach der Babypause soll vereinfacht werden, indem nach Kinderzahl gestaffelte Lohnsubventionen an die Arbeitgeber gezahlt werden.","The re-entry of parents after maternity leave is to be simplified by paying wage subsidies to employers that are graded according to the number of children.","603",NA
"Familien brauchen bezahlbaren Wohnraum.","Families need affordable housing.","603",NA
"Neben der Schaffung günstiger Mietwohnungen","In addition to creating affordable rental housing,","403",NA
"wollen wir auch möglichst viele Familien in eigene vier Wände bringen.","we also want to get as many families as possible into their own homes.","603",NA
"Dazu wollen wir Bauland vergünstigt an Familien abgeben","To this end, we want to give building land to families at reduced prices","603",NA
"und die Konditionen der KfW verbessern: Statt teurer Förderung von Energieeffizienzhäusern wollen wir gestaffelte Teilerlasse nach Kinderzahl.","and improve the conditions of the KfW: instead of expensive subsidies for energy-efficient houses, we want staggered partial reductions depending on the number of children.","603",NA
"Familienfreundliches Deutschland","Family-friendly Germany","H",NA
"Wir wollen eine kinderfreundliche Gesellschaft als Staatsziel ins Grundgesetz aufnehmen.","We want to include a child-friendly society as a state objective in the Basic Law.","603",NA
"Das stärkt Familien und verpflichtet die Politik zu echter Familienfreundlichkeit","This strengthens families and obliges politicians to be genuinely family-friendly","603",NA
"– im Gegensatz zur Aufnahme von „Kinderrechten“ ins Grundgesetz, die dem Staat nur „die Lufthoheit über den Kinderbetten“ sichern soll.","- in contrast to the inclusion of ""children's rights"" in the Basic Law, which is only intended to secure ""air sovereignty over children's beds"" for the state.","201.1",NA
"Kinder sind schon jetzt Grundrechtsträger.","Children are already fundamental rights bearers.","603",NA
"Gesonderte „Kinderrechte“ schwächen deshalb nur die Elternrechte nach Art. 6 GG.","Separate ""children's rights"" therefore only weaken parental rights under Article 6 GG.","201.1",NA
"Statt Gleichstellungsbeauftragten wollen wir Familienbeauftragte, die familienfreundliche Entscheidungen sicherstellen und somit die aktivierende Familienpolitik unterstützen.","Instead of equal opportunity officers, we want family officers who ensure family-friendly decisions and thus support activating family policies.","603",NA
"Staatliche Leistungen und Verwaltungsabläufe sind systematisch auf Familienfreundlichkeit zu prüfen und anzupassen.","State services and administrative processes are to be systematically checked for family-friendliness and adapted accordingly.","603",NA
"Über soziales Marketing soll für Familiengründungen und das Leitbild der 3-Kind- Familie geworben sowie über die damit verbundenen Angebote informiert werden.","Social marketing is to be used to promote family formation and the 3-child family model, as well as to provide information about the associated offers.","603",NA
"Mehrgenerationenfamilien sind stärker zu fördern.","Multigenerational families should be more strongly encouraged.","603",NA
"Für Arbeitgeber müssen Anreize für eine bessere Vereinbarkeit von Familie und Beruf geschaffen werden.","Incentives must be created for employers to better reconcile family and career.","603",NA
"Kinder in den Familien belassen, Kindesentzug nur in Ausnahmen","Keeping children in families, child withdrawal only in exceptions","H",NA
"Einige Familien bedürfen der staatlichen Unterstützung durch Beratung und Hilfe bei der Erziehung.","Some families need government support through counseling and help with parenting.","603",NA
"Allerdings darf dies nur in äußersten Ausnahmefällen zu einem Kindesentzug durch das Jugendamt führen.","However, this may only lead to child removal by the youth welfare office in very exceptional cases.","603",NA
"Leider hat sich in den letzten Jahren um die Inobhutnahme von Kindern eine regelrechte Industrie entwickelt, die eines ständigen Nachschubs an Kindern bedarf.","Unfortunately, in recent years a real industry has developed around the taking into care of children, which requires a constant supply of children.","603",NA
"Die Anzahl der Inobhutnahmen ist seit 1995 von 23.432 Kindern bis 2018 auf 52.590 Kinder bzw. um 124% gestiegen.","The number of children taken into care has increased since 1995 from 23,432 children to 52,590 children by 2018, or by 124%.","603",NA
"Bis 2019 haben sich die Ausgaben dafür von ca. 15 Milliarden Euro (1995) auf 50,6 Milliarden Euro vervielfacht.","By 2019, spending on this had multiplied from around 15 billion euros (1995) to 50.6 billion euros.","603",NA
"In Extremfällen musste sogar die „übermäßige Liebe der Mutter“ als Entzugsgrund herhalten.","In extreme cases, even the ""excessive love of the mother"" had to be used as a reason for withdrawal.","603",NA
"Hier fordert die AfD einen radikalen Kurswechsel.","Here, the AfD is calling for a radical change of course.","603",NA
"Wir wollen Fehlentscheidungen vermeiden, die als Willkür empfunden werden.","We want to avoid wrong decisions that are perceived as arbitrary.","603",NA
"Die Jugendpolitik muss auf eine Förderung der Familien ausgerichtet werden","Youth policies must be geared towards supporting families","603",NA
"und das Ziel verfolgen, dass die Kinder in ihren Familien bleiben.","and aim to keep children in their families.","603",NA
"Dazu müssen die Beratung und Sanktionierung von Familien innerhalb der Jugendämter auf zwei unabhängige Stellen verteilt und strikt getrennt werden.","To this end, the counseling and sanctioning of families within the youth welfare offices must be divided between two independent agencies and strictly separated.","603",NA
"Es ist seitens der Fachaufsicht und aller Leitungsebenen auf die Einhaltung der Gesetze zu achten, insbesondere muss kostenlose Akteneinsicht gewährt werden, es muss eine Angemessenheitsprüfung aller Leistungen stattfinden, ein Kindesentzug darf nur für eine kurze Zeit angeordnet werden und das Wunsch- und Wahlrecht für Leistungen des Jugendamtes nach §16 SGB VIII muss respektiert werden.","The professional supervision and all levels of management must ensure compliance with the law, in particular, free access to files must be granted, an appropriateness check of all services must take place, child removal may only be ordered for a short period of time and the right of request and choice for services of the youth welfare office according to §16 SGB VIII must be respected.","603",NA
"Wir wollen darüber hinaus eine unabhängige Kontrolle der Jugendämter und der freien Träger installieren, um dem dort herrschenden Wildwuchs Einhalt zu gebieten.","In addition, we want to install an independent control of the youth welfare offices and the independent providers in order to put a stop to the uncontrolled growth that prevails there.","603",NA
"Die Ombudsstelle muss mit Entscheidungsbefugnissen ausgestattet und bekannt gemacht werden, damit sich Eltern auch an diese wenden können.","The ombudsman's office must be given decision-making powers and made known so that parents can also turn to it.","603",NA
"Willkommenskultur für Kinder","Welcome culture for children","H",NA
"Ungeborene Kinder haben ein Recht auf Leben.","Unborn children have a right to life.","603",NA
"Viel zu oft wird dieses Recht jedoch Zukunftsängsten untergeordnet.","Far too often, however, this right is subordinated to fears about the future.","603",NA
"Solchen Ängsten will die AfD durch konkrete Hilfen für Familien in allen Lebenslagen vorbeugen, insbesondere den lebensrettenden Ausweg der Adoption erleichtern und fördern.","The AfD wants to prevent such fears by providing concrete assistance to families in all circumstances, and in particular to facilitate and promote the life-saving resort of adoption.","603",NA
"Wir wollen die Möglichkeiten der anonymen bzw. vertraulichen Geburt weiter ausbauen und stärken","We want to further expand and strengthen the options for anonymous or confidential births","706",NA
"sowie die Verfügbarkeit von Babyklappen sicherstellen.","and ensure the availability of baby drops.","706",NA
"Die Gesellschaft muss in Familien, Schule und Medien den Respekt vor dem Leben und ein positives Bild von Ehe und Elternschaft vermitteln.","Society must instill respect for life and a positive image of marriage and parenthood in families, schools, and the media.","603",NA
"Diesen Bedarf erkennt man daran, dass seit Jahren in Deutschland jährlich rund 100.000 ungeborene Kinder getötet werden, was der Zahl der Einwohner einer Großstadt entspricht.","This need can be seen from the fact that for years, around 100,000 unborn children have been killed each year in Germany, which is equivalent to the number of inhabitants of a large city.","603",NA
"Die verpflichtende Schwangerschaftskonfliktberatung ist in vielen Fällen zu einem formalen Verwaltungsakt verkümmert und befördert eine Bagatellisierung von Abtreibungen.","Mandatory pregnancy conflict counseling has in many cases degenerated into a formal administrative act and promotes a trivialization of abortions.","603",NA
"Sie muss stattdessen dem Schutz des Lebens dienen.","Instead, it must serve to protect life.","603",NA
"Wie vom Bundesverfassungsgericht zur Bedingung gestellt, ist regelmäßig die Wirksamkeit der Beratungsscheinregelung zu überprüfen.","As a condition imposed by the Federal Constitutional Court, the effectiveness of the counseling voucher scheme must be reviewed on a regular basis.","603",NA
"Gegebenenfalls ist durch gesetzliche Korrekturen ein wirksamer Lebensschutz zu gewährleisten.","If necessary, legal corrections must be made to ensure effective protection of life.","603",NA
"Schwangerschaftsberatungen müssen mit transparenten Qualitätsstandards und möglichst unter Einbeziehung der Väter durchgeführt werden.","Pregnancy counseling must be conducted with transparent quality standards and, if possible, with the involvement of fathers.","503",NA
"Abtreibungen, speziell aus sozialen und familiären Gründen, müssen dabei die Ausnahme bleiben.","Abortions, especially for social and family reasons, must remain the exception.","603",NA
"Bei der Beratung muss explizit über den Entwicklungsstand der ungeborenen Kinder und mögliche Spätfolgen einer Abtreibung aufgeklärt werden, wie z. B. das Post-Abortion-Syndrom (PAS).","During counseling, explicit information must be provided about the developmental status of unborn children and possible late effects of abortion, such as post-abortion syndrome (PAS).","603",NA
"Eine Abtreibung ist meldepflichtig,","Abortion must be reported, and","603",NA
"Verstöße dagegen sind zukünftig zu ahnden.","violations of this will be punishable in the future.","605.1",NA
"Die Abtreibungsstatistik soll dadurch die wirkliche Zahl der Abtreibungen wiedergeben.","The abortion statistics should therefore reflect the true number of abortions.","603",NA
"Die Entscheidung über eine Abtreibung muss natürlich bei der Mutter bzw. bei den Eltern liegen,","The decision to have an abortion must, of course, rest with the mother or parents,","201.1",NA
"dennoch lehnen wir alle Bestrebungen ab, die Tötung Ungeborener zu einem Menschenrecht zu erklären.","yet we reject all efforts to declare the killing of the unborn a human right.","603",NA
"Wir wenden uns strikt gegen die Kommerzialisierung des Mutterleibes durch bezahlte Leihmutterschaften","We strongly oppose the commercialization of the womb through paid surrogacy","603",NA
"und gegen die Vermarktung von Gewebe getöteter ungeborener Kinder.","and the commercialization of tissue from killed unborn children.","603",NA
"Trennungsfolgen mindern","Mitigate separation consequences","H",NA
"Kinder sind die Hauptleidtragenden, wenn sich die Eltern trennen.","Children are the main victims when parents separate.","603",NA
"Die daraus resultierenden Schäden müssen reduziert werden, indem die Problematik aus der Sicht der Kinder betrachtet wird.","The resulting damage must be reduced by looking at the problem from the children's point of view.","603",NA
"Dazu gehört auch die umfassende Unterstützung und Beratung getrennter Eltern.","This also includes comprehensive support and advice for separated parents.","603",NA
"Abstiegsängste und finanzieller Druck belasten Familien stark und führen oft zu instabilen Ehen und Trennungen.","Fears of decline and financial pressure place a heavy burden on families and often lead to unstable marriages and separations.","705",NA
"Die AfD fordert daher auch zur Vermeidung von Trennungen eine familienfreundliche Steuer- und Abgabenpolitik, die es Familien ermöglicht, auf Wunsch auch mit nur einem Erwerbseinkommen eine Familie zu ernähren, ohne gravierende Einbußen des Lebensstandards.","The AfD therefore calls for a family-friendly tax and contribution policy, also to avoid separation, that enables families to support a family with only one earned income, if desired, without serious losses in living standards.","603",NA
"Auch für Eltern, die beide berufstätig sein wollen, müssen die weiteren Rahmenbedingungen so ausgelegt werden, dass Familie und Beruf möglichst gut vereinbar sind.","For parents who both want to work, the other framework conditions must also be designed in such a way that family and career are as compatible as possible.","603",NA
"Da die Mehrheit der Trennungskinder bei den Müttern aufwächst, ist ein besonderes Augenmerk auf die Einbeziehung der Väter in die Erziehung zu legen.","Since the majority of children of separation grow up with their mothers, special attention must be paid to the involvement of fathers in their upbringing.","503",NA
"Kinder brauchen Vater und Mutter, die jeweils unterschiedliche Aspekte für die Entwicklung einbringen.","Children need both father and mother, who each bring different aspects to development.","603",NA
"Kinder dürfen nicht als Druckmittel oder Instrument der Rache dienen, indem der Kontakt dem anderen Partner erschwert oder verwehrt wird.","Children must not be used as a means of pressure or an instrument of revenge by making contact more difficult or denying it to the other partner.","603",NA
"Die Umgangsrechte und-pflichten beider Elternteile müssen entsprechend gestärkt werden.","The access rights and obligations of both parents must be strengthened accordingly.","503",NA
"Wir fordern auch bei nichtehelichen Kindern ein gemeinsames Sorgerecht ab Geburt.","We also demand joint custody from birth in the case of illegitimate children.","503",NA
"Die Reform des Familienrechts von 1977 führte dazu, dass selbst Straftaten und schwerwiegendes Fehlverhalten gegen den Ehepartner bei der Bemessung finanzieller Ansprüche nach Trennung und Scheidung oft ohne Auswirkung bleiben.","The 1977 reform of family law meant that even criminal offenses and serious misconduct against a spouse often have no effect in the assessment of financial claims after separation and divorce.","503",NA
