"text","text_en","cmp_code","eu_code"
"Es ist Zeit für mehr Gerechtigkeit!","It is time for more justice!","H",NA
"2017 ist ein entscheidendes Jahr.","2017 is a decisive year.","000",NA
"Die SPD tritt an, um mit Martin Schulz als Bundeskanzler die Weichen für die Zukunft Deutschlands und Europas zu stellen.","The SPD is running to set the course for the future of Germany and Europe with Martin Schulz as chancellor.","305.1",NA
"Die Wahlen in diesem Jahr sind grundsätzliche Entscheidungen darüber, in welcher Gesellschaft wir leben wollen.","The elections this year are fundamental decisions about what kind of society we want to live in.","000",NA
"Werte, die als selbstverständlich galten, stehen auf dem Spiel.","Values that were taken for granted are at stake.","503",NA
"Für diese Werte kämpfen wir, wie wir es in unserer langen Geschichte immer getan haben.","We fight for these values, as we have always done in our long history.","503",NA
"Für eine Gesellschaft, die jedem Menschen respektvoll und mit Würde begegnet.","For a society that treats every person with respect and dignity.","503",NA
"Unabhängig von Geschlecht, Herkunft, sexueller Identität, Religion.","Regardless of gender, origin, sexual identity, religion.","503",NA
"Unabhängig davon, ob jemand eine Behinderung hat, krank oder pflegebedürftig ist.","Regardless of whether someone has a disability, is ill or in need of care.","503",NA
"Unabhängig von Beschäftigung und Lebensgrundlage.","Regardless of employment and livelihood.","503",NA
"Wir kämpfen für die Freiheit, seine Meinung sagen und veröffentlichen zu können.","We fight for the freedom to speak and publish one's opinion.","202.1",NA
"Für eine freie Presse und eine unabhängige Justiz.","For a free press and an independent judiciary.","202.1",NA
"Wenn wir uns umschauen in Europa und der Welt, sehen wir diese Werte in Gefahr.","When we look around Europe and the world, we see these values in danger.","202.1",NA
"Für diese Werte einzustehen, war der Ursprung der Sozialdemokratie.","Standing up for these values was the origin of social democracy.","202.1",NA
"Dafür stehen wir – damals wie heute.","That's what we stand for - then and now.","202.1",NA
"Unser Land ist heute demokratischer, offener, moderner und freier als jemals zuvor.","Our country today is more democratic, open, modern and free than ever before.","202.1",NA
"Hier leben engagierte Menschen in ihren Familien, mit Freunden und Nachbarn.","Committed people live here with their families, friends and neighbors.","606.1",NA
"Hier arbeiten motivierte Arbeitnehmerinnen und Arbeitnehmer, ebenso wie selbstbewusste Gewerkschaften und erfolgreiche Unternehmen in einer starken sozialen Marktwirtschaft zusammen.","Here, motivated employees, as well as self-confident trade unions and successful companies, work together in a strong social market economy.","405",NA
"Wir sind stolz auf unseren demokratischen Rechtsstaat, der die Würde des Menschen an erste Stelle setzt.","We are proud of our democratic constitutional state, which puts human dignity first.","601.1",NA
"Unser kulturelles Leben ist einzigartig.","Our cultural life is unique.","601.1",NA
"Ebenso wie unsere Zivilgesellschaft mit ihren vielen unterschiedlichen Vereinen, Verbänden und Initiativen, den Wohlfahrtsverbänden, Kirchen und Religionsgemeinschaften, in denen sich Millionen Menschen ehrenamtlich engagieren.","The same applies to our civil society with its many different clubs, associations and initiatives, welfare organizations, churches and religious communities, in which millions of people volunteer their time.","606.1",NA
"Viele sagen, dass es ihnen eigentlich gut geht.","Many say that they are actually doing well.","601.1",NA
"Aber sie spüren auch, dass es in unserer Gesellschaft nicht überall gerecht zugeht.","But they also feel that things are not fair everywhere in our society.","503",NA
"Sie berichten von ihren Schwierigkeiten, den Hoffnungen ihrer Eltern und Zielen ihrer Kinder.","They talk about their difficulties, their parents' hopes and their children's goals.","503",NA
"Alle eint der Wunsch nach einer gerechten Gesellschaft,","They are all united by the desire for a just society","503",NA
"die zusammenhält.","that holds together.","606.1",NA
"Es ist der Wunsch nach einem Land, in dem wir füreinander da sind und uns gegenseitig mit Respekt begegnen.","It is the desire for a country where we are there for each other and treat each other with respect.","606.1",NA
"Mehr Gerechtigkeit und Respekt vor der Lebensleistung aller Menschen stärken unsere Demokratie.","More justice and respect for the life achievements of all people strengthen our democracy.","503",NA
"Dazu gehört, dass in unserem Land der gesellschaftliche Zusammenhalt wieder stärker wird und der anständige Umgang miteinander nicht durch die politische Radikalisierung verloren geht.","This includes ensuring that social cohesion in our country becomes stronger again and that decent dealings with one another are not lost to political radicalization.","606.1",NA
"Wir wollen, dass die Menschen in Deutschland sicher leben können.","We want people to be able to live safely in Germany.","605.1",NA
"Gerechtigkeit ist die zentrale Voraussetzung für Zusammenhalt und Wohlstand.","Justice is the central prerequisite for cohesion and prosperity.","503",NA
"Wir werden Einkommen und Chancen gerechter gestalten.","We will make incomes and opportunities more equitable.","701",NA
"Gesellschaften, die zusammenhalten und sozial gerecht sind, können Probleme besser meistern.","Societies that are cohesive and socially just are better able to cope with problems.","503",NA
"Gerechte Gesellschaften sind wirtschaftlich erfolgreicher und innovativer.","Just societies are more economically successful and innovative.","503",NA
"In gerechteren Gesellschaften sind die Menschen zufriedener und das gegenseitige Vertrauen ist stärker.","In more just societies, people are happier and mutual trust is stronger.","503",NA
"Gerechtigkeit macht unser Land in vielerlei Hinsicht reicher.","Justice makes our country richer in many ways.","503",NA
"Gerechtigkeit bedeutet auch soziale Sicherheit.","Justice also means social security.","503",NA
"Sichere und gute Arbeitsplätze,","Secure and good jobs,","701",NA
"die Zuversicht, dass es gute und gleiche Bildungschancen für alle Kinder gibt,","confidence that there are good and equal educational opportunities for all children,","506",NA
"Soziale Sicherheit und öffentliche Sicherheit gehören zusammen.","Social Security and Public Safety go together.","605.1",NA
"Jede und jeder hat das Recht, sich sicher bewegen zu können.","Everyone has the right to be able to move safely.","605.1",NA
"Der Staat muss für die Sicherheit aller Menschen sorgen.","The state must ensure the safety of all people.","605.1",NA
"Wenn wir für mehr Gerechtigkeit und Sicherheit sorgen, dann zahlt sich das für den Wirtschaftsstandort Deutschland aus.","If we ensure greater justice and security, this will pay off for Germany as a business location.","410",NA
"Für den weltweiten Handel und die Digitalisierung unserer Wirtschaft brauchen wir gerechte Rahmenbedingungen","For global trade and the digitalization of our economy, we need fair framework conditions","412",NA
"und modernste Infrastruktur.","and state-of-the-art infrastructure.","411",NA
"Unser Ziel ist es, die Chancen, die sich aus der Digitalisierung und der weltweiten Vernetzung ergeben, zu nutzen.","Our goal is to take advantage of the opportunities arising from digitization and global networking.","411",NA
"Wirtschaftliche Kraft,","Economic power,","410",NA
"Innovationsfreude,","Innovative spirit,","411",NA
"technologischer Fortschritt,","technological progress,","411",NA
"Nachhaltigkeit","Sustainability","416.2",NA
"und die Bewahrung der natürlichen Lebensgrundlagen sind die Grundlagen für die Zukunft Deutschlands und Europas.","and the preservation of natural resources are the foundations for the future of Germany and Europe.","501",NA
"Die SPD ist Partnerin der Gewerkschaften, der Wirtschaft und der Wissenschaft – denn wirtschaftliche Stärke ist der gemeinsame Erfolg vieler.","The SPD is a partner of the trade unions, business and science - because economic strength is the joint success of many.","410",NA
"Wir wollen eine Gesellschaft der Kultur und Kunst, die unser Leben in vielerlei Hinsicht bereichert und das Nachdenken über uns selbst befördert.","We want a society of culture and art that enriches our lives in many ways and promotes reflection on ourselves.","502",NA
"Internationale Krisen und Zuwanderung stellen Deutschland und Europa vor neue Herausforderungen.","International crises and immigration pose new challenges for Germany and Europe.","107",NA
"Eine offene Gesellschaft braucht eine starke Demokratie,","An open society needs a strong democracy","202.1",NA
"die Zusammenhalt und Solidarität fördert,","that promotes cohesion and solidarity,","606.1",NA
"Regeln durchsetzt und damit Sicherheit gewährleistet.","enforces rules and thus ensures security.","605.1",NA
"Ein friedliches Zusammenleben funktioniert nur mit der Anerkennung von Werten und Regeln, die für alle gleichermaßen gelten.","Peaceful coexistence only works with the recognition of values and rules that apply equally to everyone.","608.1",NA
"Das trifft für Deutschland ebenso zu wie für Europa.","This is as true for Germany as it is for Europe.","608.1",NA
"Die SPD steht wie keine andere Partei für die europäische Idee.","The SPD stands for the European idea like no other party.","108",NA
"Diese Idee eines geeinten Europas ist für mehr als 500 Millionen Menschen das Versprechen auf ein Leben in Frieden, Freiheit, Sicherheit und Wohlstand.","For more than 500 million people, this idea of a united Europe is the promise of a life in peace, freedom, security and prosperity.","108",NA
"Uns geht es um ein wirtschaftlich dynamisches,","What we want is an economically dynamic,","410",NA
"demokratischeres","more democratic","202.1",NA
"und sozialeres Europa,","and more social Europe","503",NA
"das die Menschen in den Mittelpunkt stellt,","that puts people at the center,","503",NA
"Verständigung schafft","builds understanding","108",NA
"und Zusammenhalt stiftet.","and creates cohesion.","108",NA
"Europa ist ein Friedensprojekt","Europe is a peace project","108",NA
"und die SPD als Friedenspartei steht für eine Außenpolitik der klugen Diplomatie.","and the SPD, as a peace party, stands for a foreign policy of clever diplomacy.","106",NA
"Im Geiste der Entspannungspolitik Willy Brandts ist es unser Anspruch, Brücken zu bauen.","In the spirit of Willy Brandt's policy of détente, our aim is to build bridges.","108",NA
"Aufrüstung und Säbelrasseln lösen keine Konflikte.","Rearmament and saber-rattling do not solve conflicts.","105",NA
"Europa, die USA, Russland und China tragen gemeinsam Verantwortung für den Frieden in der Welt","Europe, the U.S., Russia and China share responsibility for peace in the world","106",NA
"und den Kampf gegen den internationalen Terrorismus.","and the fight against international terrorism.","107",NA
"Deshalb können nur der Dialog zwischen den Regierungen, die Verständigung zwischen den Völkern und eine gelebte Solidarität zwischen Nord und Süd zu mehr globaler Sicherheit führen.","Therefore, only dialogue between governments, understanding between peoples and a lived solidarity between North and South can lead to more global security.","107",NA
"Die Zukunft Deutschlands und Europas wird das sein, was wir alle gemeinsam aus ihr machen.","The future of Germany and Europe will be what we all make of it together.","107",NA
"Veränderungsprozesse lassen sich nicht verhindern, sondern sie bieten die Chance, die Dinge zum Besseren zu wenden.","Change processes cannot be prevented, but they offer the opportunity to change things for the better.","107",NA
"Sie lassen sich politisch gestalten!","They can be shaped politically!","107",NA
"Was wir brauchen ist die Zuversicht, dass es sich lohnt, für eine bessere Zukunft zu streiten und den Mut, es anzugehen.","What we need is the confidence that it is worth fighting for a better future and the courage to go for it.","000",NA
"Zukunft ist für Sozialdemokratinnen und Sozialdemokraten ein Versprechen auf ein besseres Zusammenleben, Chancengleichheit und ein gerechtes Miteinander in einer offenen und inklusiven Gesellschaft.","For social democrats, the future is a promise of better coexistence, equal opportunities and just coexistence in an open and inclusive society.","503",NA
"Dafür arbeitet die SPD und dafür kämpfen wir.","That is what the SPD is working for and that is what we are fighting for.","305.1",NA
"Mit Martin Schulz als Bundeskanzler und einer starken SPD im Bundestag wird Deutschland gerechter, fortschrittlicher, solidarischer und nachhaltiger.","With Martin Schulz as chancellor and a strong SPD in the Bundestag, Germany will become fairer, more progressive, more solidary and more sustainable.","305.1",NA
"Es ist Zeit, jetzt zu handeln!","It's time to act now!","305.1",NA
"Es ist Zeit für mehr Gerechtigkeit!","It's time for more justice!","305.1",NA
"Es ist Zeit für mehr Familie, beste Schulen und gute Pflege","It's time for more family, best schools and good care","H",NA
"Es gibt Jahre, in denen die Familie mehr Zuwendung und mehr Zeit braucht als in anderen.","There are years when the family needs more attention and more time than in others.","603",NA
"Eltern wollen für ihre Kinder da sein","Parents want to be there for their children","603",NA
"und beruflich den Anschluss halten.","and keep up professionally.","701",NA
"Oft stehen sie zudem vor der Herausforderung, sich um pflegebedürftige Angehörige zu kümmern.","They also often face the challenge of caring for relatives in need of care.","603",NA
"Wir sorgen dafür, dass Familie, Beruf und Pflege besser zusammengehen.","We ensure that family, career and care go hand in hand better.","504",NA
"Wir ermöglichen Eltern, berufliche und familiäre Aufgaben gerecht aufzuteilen.","We enable parents to share professional and family responsibilities fairly.","504",NA
"Dafür brauchen sie ein gutes Angebot an Kitas und Schulen sowie mehr Zeit und Geld.","To do this, they need a good range of daycare centers and schools, as well as more time and money.","504",NA
"Diese Wünsche und Bedürfnisse sind für unsere Politik zentral, denn Familie ist ein fester Anker in unserem Leben.","These wishes and needs are central to our policies, because family is a firm anchor in our lives.","603",NA
"Für uns ist Familie dort, wo Menschen füreinander Verantwortung übernehmen – von der Ehe zwischen Mann und Frau über alleinerziehende Mütter und Väter, Patchworkfamilien bis zum gleichgeschlechtlichen Paar.","For us, family is where people take responsibility for each other - from marriage between a man and a woman to single mothers and fathers, patchwork families and same-sex couples.","604",NA
"Unsere Bildungspolitik schafft gleiche Chancen für alle.","Our education policy creates equal opportunities for all.","503",NA
"Denn noch entscheidet hier zu oft der Geldbeutel der Eltern.","Because it is still too often the parents' wallets that decide.","503",NA
"Deshalb machen wir die Bildung gebührenfrei.","That's why we're making education tuition-free.","504",NA
"Und zwar von der Kita über die Ausbildung und das Erststudium bis zum Master und zur Meister-/Technikerprüfung.","And this is true from daycare through training and first degree to master's degree and master craftsman's/technician's examination.","504",NA
"Wir werden die Schulen modernisieren und in den Ausbau von Ganztagsschulen investieren.","We will modernize schools and invest in the expansion of all-day schools.","411",NA
"Kinder, Eltern und Lehrkräfte sollen erleben, dass uns Bildung viel wert ist.","Children, parents and teachers should experience that education is worth a lot to us.","506",NA
"Es ist unsere Aufgabe, junge Menschen dabei zu unterstützen, ihren Weg zu gehen.","It is our job to help young people find their way.","506",NA
"Das geht nur mit einer eigenständigen Jugendpolitik, die Jugendlichen passende Angebote für ihre jeweilige Lebenssituation macht.","This can only be achieved with an independent youth policy that provides young people with suitable offers for their respective life situations.","706",NA
"Die gleiche Sorgfalt und Energie, die wir für unsere Kinder verwenden, brauchen wir auch für die Älteren in unserer Familie.","The same care and energy we use for our children is needed for the elders in our family.","706",NA
"Ältere Menschen müssen so lange wie möglich am gesellschaftlichen Leben teilhaben und selbst über ihr Leben bestimmen können.","Older people must be able to participate in social life and determine their own lives for as long as possible.","706",NA
"Wenn sie Hilfe oder Pflege benötigen, sollen sie sich darauf verlassen können, dass sie die notwendige Unterstützung bekommen.","If they need help or care, they should be able to rely on getting the support they need.","504",NA
"Pflege ist keine Privatsache.","Care is not a private matter.","504",NA
"Diejenigen, die sich um andere kümmern, lassen wir nicht alleine.","Those who care for others, we do not leave alone.","504",NA
"Familie ist Lebensmittelpunkt.","Family is the center of life.","603",NA
"Und glückliche Familien, die ohne Sorgen leben können, geben uns Kraft für die Zukunft.","And happy families who can live without worries give us strength for the future.","603",NA
"Familienarbeitszeit und Familiengeld:","Family working time and family allowance:","H",NA
"Wir wollen, dass Familie und Beruf als doppeltes Glück empfunden wird.","We want family and career to be perceived as a double happiness.","603",NA
"Viele Eltern wünschen sich, ihre Arbeit und die Kindererziehung partnerschaftlich aufteilen zu können.","Many parents wish to be able to divide their work and child rearing as partners.","604",NA
"Bislang heißt das allerdings, finanzielle und berufliche Nachteile in Kauf nehmen zu müssen.","So far, however, this has meant having to put up with financial and professional disadvantages.","604",NA
"Das wollen wir ändern!","We want to change that!","604",NA
"Wir unterstützen Eltern: mit der Einführung der Familienarbeitszeit und des Familiengeldes.","We support parents: with the introduction of family working time and family allowance.","604",NA
"Noch ist es so, dass viele junge Väter nach kurzer Elternzeit voll in ihre Jobs zurückkehren.","It is still the case that many young fathers return to their jobs full time after a short period of parental leave.","604",NA
"Obwohl die meisten gern etwas weniger arbeiten würden als vorher, um mehr Zeit mit der Familie zu haben.","Although most would like to work a little less than before to have more time with family.","604",NA
"Mütter steigen hingegen oft nach einem Jahr Elternzeit in Teilzeit wieder ein, obwohl sie gern etwas mehr arbeiten würden.","Mothers, on the other hand, often return to work part-time after a year of parental leave, even though they would like to work a little more.","604",NA
"Das verhindert nicht nur eine partnerschaftliche Aufteilung der Arbeit und Kindererziehung, sondern hat für Frauen negative Folgen: geringeres Einkommen, schlechtere Aufstiegschancen und später eine geringere Rente.","This not only prevents work and child-rearing from being shared as partners, but also has negative consequences for women: lower income, poorer opportunities for advancement and a lower pension later on.","604",NA
"Als ersten Schritt haben wir bereits das ElterngeldPlus eingeführt, das es Eltern ganz kleiner Kinder leichter macht, Elternzeit und Teilzeitarbeit miteinander zu verbinden.","As a first step, we have already introduced ElterngeldPlus, which makes it easier for parents of very young children to combine parental leave and part-time work.","604",NA
"In einem nächsten Schritt werden wir eine Familienarbeitszeit einführen.","In a next step, we will introduce a family working time.","604",NA
"Wenn beide Eltern ihre Arbeitszeit partnerschaftlich aufteilen, erhalten sie das Familiengeld.","If both parents share their working hours as partners, they receive the family allowance.","604",NA
"Es beträgt jeweils 150 Euro monatlich für beide Eltern, wenn sie jeweils 75 Prozent bis 90 Prozent der jeweiligen regulären Vollzeit arbeiten (das entspricht je nach betrieblicher bzw. tarifvertraglich geltender Vollzeit 26 bis 36 Wochenstunden).","It amounts to 150 euros per month for both parents if they each work 75 percent to 90 percent of the respective regular full-time (this corresponds to 26 to 36 hours per week, depending on the company or collectively agreed full-time hours).","604",NA
"Gerade Familien mit kleinen Einkommen sollen sich eine gerechte Aufteilung von Familie und Beruf leisten können.","Families with low incomes in particular should be able to afford a fair division of family and career.","604",NA
"Natürlich werden auch Allein- oder getrennt Erziehende sowie Regenbogenfamilien das Familiengeld erhalten.","Of course, single or separated parents and rainbow families will also receive the family allowance.","604",NA
"Wir werden die Gewerkschaften dabei unterstützen, diese Regelung tarifvertraglich zu begleiten.","We will support the trade unions in supporting this arrangement through collective bargaining.","405",NA
"Mehr Zeit für die Familie braucht auch einen Kulturwandel in der Arbeitswelt.","More time for the family also requires a cultural change in the working world.","701",NA
"Dazu gehört auch die Abkehr vom „Präsenz-Wettbewerb“ im Beruf.","This includes moving away from ""presence competition"" at work.","701",NA
"Für familiengerechte Arbeits- und Besprechungszeiten, Homeoffice- und Dienstreiseregelungen sind die Arbeitgeberinnen und Arbeitgeber in der Pflicht.","Employers have a responsibility to provide family-friendly work and meeting schedules, home office and business travel arrangements.","412",NA
"Der öffentliche Dienst soll dabei Vorreiter sein und die partnerschaftliche Aufteilung von Erwerbsarbeit, Kindererziehung und Pflege fördern.","The public sector should be a pioneer in this respect and promote the sharing of gainful employment, child-rearing and care in a spirit of partnership.","604",NA
"Gute Bildung von Anfang an:","Good education from the start:","H",NA
"Wir sorgen für ein ausreichendes Angebot an Krippen, Kitas, Kindertagespflege, Horten und Ganztagsschulen.","We ensure a sufficient supply of crèches, daycare centers, day nurseries, after-school care centers and all-day schools.","411",NA
"Die Kita-Gebühren schaffen wir schrittweise ab und entlasten damit alle Familien, die jetzt noch für die Betreuung zahlen müssen.","We are gradually abolishing daycare fees, thus relieving the burden on all families who now still have to pay for care.","506",NA
"Außerdem werden wir in Bildung und Betreuung am Nachmittag investieren und einen Rechtsanspruch auf Ganztagsbetreuung von Kita- und Grundschulkindern einführen – mit finanzieller Beteiligung des Bundes.","We will also invest in education and care in the afternoon and introduce a legal entitlement to all-day care for daycare and elementary school children - with financial participation from the federal government.","506",NA
"Ziel muss es dabei sein, die Vereinbarkeit von Familie und Beruf auch durch bedarfsgerechte Betreuungsangebote zu anderen Tageszeiten als bisher zu verbessern.","The aim must be to improve the compatibility of family and career by offering childcare at different times of the day to meet demand.","506",NA
"Mit einem bundesweiten Gesetz werden wir die Qualität von Kitas mit Unterstützung des Bundes steigern.","With a nationwide law, we will increase the quality of daycare centers with federal support.","506",NA
"Wir brauchen besser ausgestattete Kitas und eine gesunde Ernährung.","We need better equipped daycare centers and a healthy diet.","506",NA
"Mit zusätzlichen Erzieherinnen und Erziehern können die Kinder in den Gruppen besser betreut werden.","With additional educators, the children in the groups can be better cared for.","506",NA
"Dafür wollen wir den Beruf aufwerten und die Ausbildung verbessern.","To achieve this, we want to upgrade the profession and improve training.","701",NA
"Wir werden dies mit einer Fachkräfteoffensive unterstützen.","We will support this with a skilled labor offensive.","701",NA
"Zusätzlich wollen wir die Kindertagespflege weiter professionalisieren und aufwerten.","In addition, we want to further professionalize and upgrade day care for children.","506",NA
"Kinderarmut bekämpfen:","Tackling Child Poverty:","H",NA
"Kinderarmut darf es in einem so reichen Land wie unserem nicht geben.","Child poverty must not exist in a country as rich as ours.","504",NA
"Denn sie bedeutet vor allem auch: Schlechteren Zugang zu Bildung, Kultur und Sport – und damit schlechtere Zukunftschancen.","Because it also means, above all, poorer access to education, culture and sport - and thus poorer opportunities for the future.","504",NA
"Wir werden die Benachteiligung von Kindern armer Eltern beseitigen und ihnen eine gleichberechtigte Teilhabe ermöglichen.","We will eliminate discrimination against children of poor parents and enable them to participate on an equal footing.","504",NA
"Dabei werden wir vor allem auch die besondere Lebenssituation von Kindern berücksichtigen, die mit einem Elternteil aufwachsen.","In particular, we will also take into account the special life situation of children growing up with one parent.","604",NA
