"text","text_en","cmp_code","eu_code"
"Energiewende vollenden:","Completing the energy transition:","H",NA
"Energie muss umweltfreundlich und bezahlbar sein.","Energy must be environmentally friendly and affordable.","416.2",NA
"Gleichzeitig muss die verlässliche Versorgung gesichert bleiben.","At the same time, reliable supply must remain assured.","411",NA
"Das sind für uns drei gleichrangige Ziele der Energiewende.","For us, these are three equally important goals of the energy transition.","416.2",NA
"Es ist eine Frage der Gerechtigkeit, dass wir erneuerbare Energien weiter ausbauen.","It is a question of justice that we continue to expand renewable energies.","416.2",NA
"Erneuerbare Energien aus Windkraft (Off- und Onshore) und Sonnenenergie sind langfristig die kostengünstigste Form der Energieerzeugung.","Renewable energy from wind power (offshore and onshore) and solar power is the most cost-effective form of energy generation in the long term.","416.2",NA
"Sie machen uns unabhängig von Öl, Erdgas und Uran aus Konfliktregionen.","They make us independent of oil, natural gas and uranium from conflict regions.","416.2",NA
"Sie tragen zur lokalen Wertschöpfung bei und zu einem fairen Energiemarkt.","They contribute to local value creation and a fair energy market.","416.2",NA
"Damit die Energiewende erfolgreich fortgeführt werden kann, müssen die verschiedenen Energiesektoren stärker verbunden werden.","For the energy transition to continue successfully, the various energy sectors must be more closely linked.","416.2",NA
"Bisher findet die Energiewende hauptsächlich im Stromsektor statt.","So far, the energy transition has mainly taken place in the electricity sector.","416.2",NA
"Durch Sektorenkopplung soll die Energiewende noch stärker in den Wärme- und Verkehrssektor getragen werden.","Through sector coupling, the energy turnaround is to be carried even more strongly into the heating and transport sectors.","416.2",NA
"Speicher und andere Technologien für die Sektorenkopplung sowie die Flexibilisierung und die Digitalisierung der Energiewende wollen wir gezielt durch technologieoffene gesetzliche Rahmenbedingungen","We want to promote storage and other technologies for sector coupling as well as the flexibilization and digitalization of the energy transition in a targeted manner through a technology-open legal framework.","412",NA
"sowie durch Forschungs- und Entwicklungsprogramme voranbringen.","and through research and development programs.","402",NA
"Der zügige Netzausbau auf Verteil- und Übertragungsnetzebene ist für das Gelingen der Energiewende von entscheidender Bedeutung.","Rapid grid expansion at distribution and transmission grid level is crucial to the success of the energy transition.","411",NA
"Bestehende Stromleitungen sollen mit Hilfe neuer Technologien besser ausgelastet werden.","Existing power lines are to be better utilized with the help of new technologies.","411",NA
"Maßnahmen zur Energieeffizienz werden wir ausbauen.","We will expand energy efficiency measures.","416.2",NA
"Wir wollen insbesondere den öffentlichen Gebäudebestand und den öffentlichen Nahverkehr zu Vorbildern des nachhaltigen und energieeffizienten Verbrauchs entwickeln.","In particular, we want to develop the public building stock and public transport into models of sustainable and energy-efficient consumption.","416.2",NA
"Energieeffizienzstandards von Produkten und Dienstleistungen werden wir weiter verbessern.","We will continue to improve the energy efficiency standards of products and services.","416.2",NA
"Spätestens 2050 müssen wir Energie weitestgehend treibhausgasneutral erzeugen.","By 2050 at the latest, we must generate energy in a way that is largely greenhouse gas neutral.","416.2",NA
"Wir stellen dabei sicher, dass Deutschlands Industrie international wettbewerbsfähig bleibt.","In doing so, we ensure that Germany's industry remains internationally competitive.","410",NA
"Den europäischen Emissionshandel werden wir so weiterentwickeln, dass er seine Funktion als zentrales Klimaschutzinstrument erfüllen kann.","We will further develop European emissions trading so that it can fulfill its function as a central climate protection instrument.","416.2",NA
"Sollte dies nicht zu erreichen sein, werden wir Verhandlungen für die Vereinbarung von CO2-Mindestpreisen auf europäischer Ebene aufnehmen.","If this cannot be achieved, we will start negotiations to agree minimum CO2 prices at European level.","412",NA
"Dabei werden wir unterschiedliche Wettbewerbsbedingungen im Klimaschutz berücksichtigen und „Carbon-Leakage“ verhindern.","In doing so, we will take into account different competitive conditions in climate protection and prevent ""carbon leakage.""","412",NA
"Die vollständige Energiewende gelingt nur, wenn auf dem Weg dorthin konventionelle Energieträger den Ausbau der erneuerbaren Energien ergänzen.","The complete energy turnaround will only succeed if conventional energy sources complement the expansion of renewables along the way.","416.2",NA
"Erdgas, erneuerbares Gas aus Power-To-Gas-Anlagen und die bestehende Gasnetzinfrastruktur werden im Energiemix für eine flexible, sichere und CO2-arme Energieerzeugung immer bedeutender.","Natural gas, renewable gas from power-to-gas plants, and the existing gas grid infrastructure are becoming increasingly important in the energy mix for flexible, secure, and low-carbon power generation.","416.2",NA
"Moderne Anlagen der Kraft-Wärme-Kopplung werden eine wichtige Rolle im Energiesystem übernehmen.","Modern cogeneration plants will play an important role in the energy system.","416.2",NA
"Wir werden sie deshalb entsprechend fördern.","We will therefore promote them accordingly.","402",NA
"Der Schutz unseres Trinkwassers und der Gesundheit haben für uns oberste Priorität.","Protecting our drinking water and health are our top priorities.","501",NA
"Daher haben wir ein unbefristetes Verbot für unkonventionelles Fracking durchgesetzt.","That is why we have pushed through an indefinite ban on unconventional fracking.","412",NA
"Die hier bestehenden Risiken für Mensch und Umwelt sind größer als die wirtschaftlichen Chancen.","The risks to people and the environment here are greater than the economic opportunities.","416.2",NA
"Deshalb stehen wir dafür, dass es bei einem Verbot bleibt.","That is why we stand for it to remain a ban.","412",NA
"Zudem werden wir die Schutzstandards in der konventionellen Erdgasförderung überprüfen und beständig anpassen.","In addition, we will review and continuously adjust protection standards in conventional natural gas production.","412",NA
"2022 wird das letzte deutsche Atomkraftwerk abgeschaltet.","The last German nuclear power plant will be shut down in 2022.","501",NA
"Mit dem hinterlassenen Atommüll müssen wir gesamtgesellschaftlich verantwortungsvoll umgehen.","We must deal responsibly with the nuclear waste left behind by society as a whole.","501",NA
"Das gilt nicht zuletzt für die Konzerne, die mit Atomkraftwerken jahrzehntelang viel Geld verdient haben.","This applies not least to the corporations that have made a lot of money from nuclear power plants for decades.","503",NA
"Mit dem schwarz-gelben Ausstieg aus dem Ausstieg ist allein durch den Wegfall der Brennelementesteuer ein Schaden von sieben Milliarden Euro entstanden.","The black-yellow phase-out has resulted in a loss of seven billion euros from the elimination of the nuclear fuel tax alone.","305.1",NA
"Diese Überwälzung auf die Steuerzahlerinnen und Steuerzahler ist unverantwortlich.","This pass-through to taxpayers is irresponsible.","701",NA
"Die Endlagerung des Atommülls muss nach menschlichen Maßstäben auf ewig sicher sein.","The final disposal of nuclear waste must be eternally safe by human standards.","501",NA
"Wir werden bei anderen Staaten aktiv dafür werben, aus der Atomenergie auszusteigen.","We will actively lobby other countries to phase out nuclear energy.","501",NA
"In der EU werden wir uns dafür einsetzen, die Fördermöglichkeiten zum Bau neuer Atomkraftwerke abzuschaffen.","In the EU, we will work to abolish subsidies for the construction of new nuclear power plants.","416.2",NA
"In Deutschland werden wir die Hermes-Kreditbürgschaften für Exporte so regeln, dass Atomenergie-Projekte davon ausgeschlossen werden.","In Germany, we will regulate Hermes loan guarantees for exports in such a way that nuclear energy projects are excluded from them.","412",NA
"Wir wollen, dass alle Menschen an der Rendite der Energiewende teilhaben.","We want everyone to share in the returns from the energy transition.","503",NA
"Deswegen sind Mieterstrommodelle für uns so wichtig.","That's why tenant electricity models are so important to us.","503",NA
"Mieterinnen und Mieter sollen von der Einspeisung regenerativer Energien und einer eigenen Stromerzeugung finanziell profitieren.","Tenants should benefit financially from feeding renewable energies into the grid and generating their own electricity.","503",NA
"Wir werden Hausbesitzerinnen und Hausbesitzer weiterhin dabei unterstützen, ihre Häuser und Gebäude auf wirtschaftliche Weise energetisch zu sanieren und mit erneuerbaren Energien zu versorgen.","We will continue to support homeowners to economically retrofit their homes and buildings for energy efficiency and renewable energy.","416.2",NA
"Wir werden gleichzeitig darauf achten, dass Wohnen für Mieterinnen und Mieter bezahlbar bleibt.","At the same time, we will ensure that housing remains affordable for tenants.","503",NA
"Sinkende Börsenstrompreise und Einkaufspreise der Gasversorger müssen bei den Verbraucherinnen und Verbrauchern ankommen.","Falling electricity prices on the stock exchange and gas suppliers' purchase prices must be passed on to consumers.","403",NA
"Wir wollen alternative Finanzierungsmodelle der Energiewende prüfen.","We want to examine alternative financing models for the energy transition.","402",NA
"Wir werden Bürger-Energiegenossenschaften fördern.","We will promote citizen energy cooperatives.","402",NA
"Kommunen sollen ihre Netzinfrastruktur rekommunalisieren können, wenn sichergestellt ist, dass der Netzbetrieb sicher und effizient erbracht werden kann.","Municipalities should be able to remunicipalize their network infrastructure if it is ensured that network operation can be provided safely and efficiently.","301",NA
"Den Stadtwerken kommt bei der Umsetzung der Energiewende eine Schlüsselrolle zu.","Municipal utilities have a key role to play in implementing the energy transition.","301",NA
"Schutz der biologischen Vielfalt:","Biodiversity protection:","H",NA
"Eine intakte Umwelt ist unverzichtbar für ein gesundes und gutes Leben.","An intact environment is indispensable for a healthy and good life.","501",NA
"Wir werden bedrohte Tier- und Pflanzenarten und ihre Lebensräume besser schützen.","We will better protect endangered animal and plant species and their habitats.","501",NA
"Der Flächenverbrauch in Deutschland ist zu hoch.","Land consumption in Germany is too high.","501",NA
"Langfristig müssen sich Versiegelung und Entsiegelung von Flächen die Waage halten.","In the long term, sealing and unsealing of surfaces must be balanced.","501",NA
"Bereits genutzte Flächen sollen umgewandelt und wiederverwertet werden, anstatt immer neue Flächen zu beanspruchen.","Land that is already in use should be converted and recycled instead of always taking up new land.","501",NA
"Wir brauchen außerdem mehr Natur in der Stadt – in Wohngebieten, in den Parks und auf den Dächern.","We also need more nature in the city - in residential areas, in parks and on rooftops.","501",NA
"Wir werden planerische, konzeptionelle und finanzielle Voraussetzungen dafür schaffen.","We will create the planning, conceptual and financial conditions for this.","501",NA
"Grünflächen haben auch eine wichtige soziale Funktion.","Green spaces also have an important social function.","501",NA
"Sie sind Orte des Austausches und der Begegnung.","They are places of exchange and encounter.","501",NA
"Die Maßnahmen aus der Naturschutz-Offensive 2020 müssen umgesetzt werden.","The measures from the Nature Conservation Offensive 2020 must be implemented.","501",NA
"Gemeinsam mit den Bundesländern werden wir das nationale Ziel von zwei Prozent großflächiger Wildnisgebiete in Deutschland vorantreiben.","Together with the federal states, we will drive forward the national goal of two percent large-scale wilderness areas in Germany.","501",NA
"Außerdem werden wir das Bundesprogramm Blaues Band zur Renaturierung von Flüssen und Auen umsetzen.","We will also implement the federal Blue Ribbon program for the renaturation of rivers and floodplains.","501",NA
"Weitere naturschutzrelevante und ehemals militärisch genutzte Liegenschaften werden wir für den Naturschutz und künftige Generationen sichern.","We will secure further properties relevant to nature conservation and formerly used by the military for nature conservation and future generations.","501",NA
"Wir werden zudem eine Moorschutzstrategie erarbeiten und umsetzen.","We will also develop and implement a peatland protection strategy.","501",NA
"Den Anteil der Flächen mit natürlicher Waldentwicklung wollen wir auf fünf Prozent der Gesamtwaldfläche beispielsweise zehn Prozent der öffentlichen Waldfläche erhöhen.","We want to increase the proportion of areas with natural forest development to five percent of the total forest area, for example ten percent of the public forest area.","501",NA
"Die Jagd soll zeitgemäß und naturnah sein.","Hunting should be contemporary and close to nature.","501",NA
"In unseren nationalen Gewässern werden wir Fischerei und andere Nutzungen naturschutzgerecht regeln.","In our national waters, we will regulate fishing and other uses in a manner consistent with conservation.","501",NA
"Gleichzeitig unterstützen wir die Fischerei dabei, nur noch umweltgerechte Fangmethoden einzusetzen.","At the same time, we support fisheries in using only environmentally sound fishing methods.","501",NA
"Der Überfischung unserer Meere werden wir durch eine Umsetzung der wissenschaftlichen Fangmengenvorgaben entgegenwirken.","We will counteract the overfishing of our seas by implementing scientific catch targets.","501",NA
"Wir reduzieren die Verschmutzung von Nord- und Ostsee durch Plastik, Fischereimüll und Nährstoffeinträge sowie durch Lärm.","We are reducing pollution of the North Sea and Baltic Sea from plastic, fisheries waste and nutrient inputs, as well as from noise.","501",NA
"Beim internationalen Meeresschutz setzen wir uns bei den Vereinten Nationen für großflächige Schutzgebiete auf hoher See ein.","In international marine protection, we are lobbying the United Nations for large-scale protected areas on the high seas.","501",NA
"Dies betrifft auch die internationalen Gewässer der Arktis.","This also affects the international waters of the Arctic.","501",NA
"Wir werden uns weiterhin für die Einrichtung eines Arktis-Schutzgebietes bei der internationalen Meeresschutzorganisation „OSPAR“ einsetzen.","We will continue to advocate for the establishment of an Arctic protected area with the international marine conservation organization ""OSPAR"".","501",NA
"Kreislaufwirtschaft und Ressourceneffizienz:","Circular economy and resource efficiency:","H",NA
"Der weltweit rasant steigende Verbrauch von natürlichen Ressourcen führt zu Problemen, die vor allem unsere Kinder und Enkelkinder belasten.","The rapidly increasing consumption of natural resources worldwide is leading to problems that will burden our children and grandchildren in particular.","501",NA
"Aktuelle Konsumgewohnheiten und moderne Technologien führen zu immer mehr und neuartigen Abfällen, deshalb fordern wir ein Umdenken weg von der Wegwerfkultur","Current consumer habits and modern technologies are leading to more and new types of waste, which is why we are calling for a rethink away from the throwaway culture and","501",NA
"hin zur Stärkung von nachhaltigen Systemen, wie Leasing- und Leihsystemen.","towards strengthening sustainable systems, such as leasing and lending systems.","416.2",NA
"Wir werden Haushalte und Unternehmen stärker über ressourcenschonende Alternativen informieren.","We will provide households and businesses with more information about resource-saving alternatives.","416.2",NA
"Ziel muss sein, Abfall zu vermeiden, Produkte langlebiger zu machen und mehr zu recyceln.","The goal must be to avoid waste, make products more durable and recycle more.","416.2",NA
"Der verminderte Einsatz von Ressourcen führt zu geringeren Material- und Energiekosten","The reduced use of resources leads to lower material and energy costs and","501",NA
"und stärkt zugleich die Wettbewerbsfähigkeit der deutschen Wirtschaft.","at the same time strengthens the competitiveness of the German economy.","410",NA
"Wir werden die öffentliche Beschaffung stärker auf ressourcenschonende Produkte und Dienstleistungen ausrichten","We will focus public procurement more strongly on resource-conserving products and services","416.2",NA
"und das Thema stärker in der Aus- und Weiterbildung verankern.","and anchor the topic more firmly in education and training.","506",NA
"Verantwortungsvolle Landwirtschaft und gesunde Ernährung:","Responsible agriculture and healthy food:","H",NA
"Wir wollen eine Landwirtschaft, die auf Umwelt- und Naturschutz,","We want an agriculture that is based on environmental protection and nature conservation,","501",NA
"die Interessen der Verbraucherinnen und Verbraucher","the interests of consumers","403",NA
"und das Wohl der Tiere ausgerichtet ist.","and the welfare of the animals.","501",NA
"Die Landwirtschaft - im Haupt- und Nebenerwerb - soll den Beschäftigten gerechte Arbeitsbedingungen und eine faire Entlohnung sichern.","Agriculture - full-time and part-time - should ensure fair working conditions and fair pay for employees.","701",NA
"Viele landwirtschaftliche Betriebe sind in ihrer Existenz bedroht und brauchen eine neue wirtschaftliche Perspektive.","Many farms are threatened in their existence and need a new economic perspective.","703.1",NA
"Denn immer mehr bäuerliche Betriebe verlieren den Wettbewerb gegen industrielle Anlagen.","This is because more and more farms are losing out to industrial plants.","703.1",NA
"Wir wollen die Position der Landwirtinnen und Landwirte in der Wertschöpfungs- und Vermarktungskette ihrer Produkte stärken.","We want to strengthen the position of farmers in the value and marketing chain of their products.","703.1",NA
"Regionalvermarktungsinitiativen sollen Unterstützung erfahren, unter anderem durch ein Bundesprogramm Regionalvermarktung.","Regional marketing initiatives should receive support, including through a federal regional marketing program.","703.1",NA
"Dadurch verbleibt ein größerer Anteil der Wertschöpfung in der Region.","As a result, a larger share of the value added remains in the region.","703.1",NA
"Ein fairer Preis für Lebensmittel trägt dazu bei, die Existenz landwirtschaftlicher Betriebe dauerhaft zu sichern.","A fair price for food helps to secure the existence of farms in the long term.","703.1",NA
"Wir werden uns dafür einsetzen, dass alle Betriebe ihre Produktion an dem Leitbild der Nachhaltigkeit","We will work to ensure that all companies base their production on the guiding principle of sustainability.","416.2",NA
"und den Verbraucherinteressen ausrichten.","and the interests of consumers.","403",NA
"Die ökologische Landwirtschaft ist derzeit die nachhaltigste Form der Landwirtschaft.","Organic farming is currently the most sustainable form of agriculture.","416.2",NA
"Um die Nachfrage nach Lebensmitteln zu bedienen, sind die konventionelle und ökologische Landwirtschaft gleichermaßen notwendig.","To meet the demand for food, conventional and organic agriculture are equally necessary.","703.1",NA
"Die SPD bekennt sich deshalb zu beiden Produktionsformen.","The SPD is therefore committed to both forms of production.","703.1",NA
"Den Einsatz von Pflanzenschutzmitteln und Dünger werden wir auf das unbedingt notwendige Maß reduzieren und das Bundesbodenschutzgesetz novellieren.","We will reduce the use of pesticides and fertilizers to the absolute minimum and amend the Federal Soil Protection Act.","501",NA
"Weiterhin setzen wir uns für gentechnikfreie Landwirtschaft und Lebensmittel ein.","Furthermore, we are committed to GMO-free agriculture and food.","416.2",NA
"Wir werden sicherstellen, dass auch bei den sogenannten neuen Gentechnikverfahren das Vorsorgeprinzip und die Wahlfreiheit gewährleistet sind","We will ensure that the precautionary principle and freedom of choice are also guaranteed in the case of so-called new genetic engineering methods,","416.2",NA
"und damit erzeugte Pflanzen und Tiere nicht unreguliert in den Markt gelangen.","and that plants and animals produced in this way do not enter the market unregulated.","412",NA
"Wir unterstützen Betriebe, die eine artgerechte Tierhaltung betreiben","We support farms that practice species-appropriate animal husbandry","703.1",NA
"und wollen eine Kennzeichnung von Lebensmitteln aus artgerechter Haltung.","and want food from species-appropriate husbandry to be labeled.","412",NA
"Dafür werden wir ein staatliches Tierschutzlabel auf Grundlage der Kriterien des Deutschen Tierschutzbundes einführen.","To this end, we will introduce a state animal welfare label based on the criteria of the German Animal Welfare Association.","412",NA
"Der Gedanke des Tierschutzes soll fest in Aus-, Fort- und Weiterbildung verankert werden.","The idea of animal welfare is to be firmly anchored in education, training and continuing education.","501",NA
"Prüf- und Zulassungsverfahren für Stallhaltungssysteme, Tierschutzindikatoren sowie bessere Haltungs- und Transportbedingungen sollen zu mehr Tierschutz beitragen.","Testing and approval procedures for housing systems, animal welfare indicators and better housing and transport conditions are intended to contribute to greater animal welfare.","501",NA
"Wir wollen eine nationale und europäische Nutztierstrategie erarbeiten und ein modernes Tierschutzgesetz schaffen, das die Würde und das Wohlergehen der Tiere schützt.","We want to develop a national and European farm animal strategy and create a modern animal protection law that protects the dignity and welfare of animals.","501",NA
"Eingriffe an Tieren aus rein wirtschaftlichen Gründen wie das Schnabelkürzen, das Kupieren von Schwänzen oder den Schenkelbrand bei Pferden werden wir verbieten.","We will ban interventions on animals for purely economic reasons, such as beak trimming, tail docking or thigh branding in horses.","501",NA
"Der Arzneimitteleinsatz, insbesondere Antibiotika, in der Tierhaltung muss auf das notwendige Maß reduziert werden.","The use of medicines, especially antibiotics, in animal husbandry must be reduced to the necessary level.","501",NA
"Wir wollen auch für Haustiere fachkundige Halterinnen und Halter.","We want expert keepers for pets, too.","501",NA
"Für Qualzuchten muss es eine klare Definition und ein Haltungsverbot geben.","There must be a clear definition and a ban on keeping for torture breeds.","501",NA
"Den Schutz von Wildtieren wollen wir vorantreiben.","We want to drive forward the protection of wildlife.","501",NA
"Den illegalen Wildtierhandel und den Handel mit Wildfängen auf gewerblichen Tierbörsen werden wir unterbinden.","We will stop the illegal trade in wild animals and the trade in wild catches at commercial animal exchanges.","501",NA
"Wir wollen eine Ombudsstelle für einen besseren Tierschutz.","We want an ombudsman office for better animal welfare.","501",NA
"Mit einem Verbandsklagerecht werden wir anerkannten Tierschutzorganisationen die rechtliche Handhabe geben, wirkungsvoller gegen Tierschutzverstöße vorzugehen.","With a right of action for associations, we will give recognized animal protection organizations the legal means to take more effective action against animal protection violations.","501",NA
"Auch Tierversuche müssen weiter reduziert werden.","Animal testing must also be further reduced.","501",NA
"Im Umwelt- und im Bauplanungsrecht nimmt die Landwirtschaft eine Sonderposition ein.","Agriculture occupies a special position in environmental and construction planning law.","703.1",NA
"Fehlsteuerungen werden wir beseitigen.","We will eliminate missteering.","703.1",NA
"Baurechtlich sollen beispielsweise große Tierhaltungsanlagen im Außenbereich nur noch zugelassen werden, wenn die Gemeinde einen entsprechenden Bebauungsplan erlässt","Under building law, for example, large animal husbandry facilities in outdoor areas are now only to be permitted if the municipality issues a corresponding development plan","301",NA
"und eine Umweltverträglichkeitsprüfung durchführt.","and carries out an environmental impact assessment.","501",NA
"Das hilft dem Umweltschutz","This helps environmental protection","501",NA
"und stärkt die Akzeptanz der Landwirtschaft in der Bevölkerung.","and strengthens the acceptance of agriculture among the population.","703.1",NA
"Die Landwirtschaft erhält mehr als jeder andere Wirtschaftsbereich Unterstützung aus Steuermitteln.","Agriculture receives more tax support than any other sector of the economy.","703.1",NA
"Wir wollen, dass der Grundsatz „öffentliches Geld nur für öffentliche Leistungen“ gilt.","We want the principle of ""public money only for public services"" to apply.","412",NA
"Zu den öffentlichen Leistungen gehört die Ernährungssicherheit genauso wie der Schutz der Natur, der Umwelt, des Klimas und des Tierwohls.","Public services include food security as well as the protection of nature, the environment, the climate and animal welfare.","501",NA
