"text","text_en","cmp_code","eu_code"
"Dies betrifft insbesondere die Anhörungs- und Beteiligungsverpflichtung bei der Einstellung von Menschen mit Behinderungen, bei Abmahnungen und Aufhebungsverträgen.","This relates in particular to the obligation to consult and participate in the hiring of persons with disabilities, in the case of warnings and termination agreements.","405",NA
"Wir treten dafür ein, dass die pauschalen Steuerfreibeträge für Menschen mit Behinderungen im Einkommenssteuergesetz angepasst werden.","We advocate that the flat tax allowances for people with disabilities in the Income Tax Act be adjusted.","503",NA
"Das gesellschaftliche Leben muss auf allen Ebenen für Menschen mit Behinderung inklusiv gestaltet werden.","Social life must be inclusive at all levels for people with disabilities.","503",NA
"Dabei sind Barrierefreiheit und angemessene Vorkehrungen unverzichtbar und brauchen bessere gesetzliche Bestimmungen.","In this context, accessibility and reasonable accommodation are indispensable and need better legal provisions.","503",NA
"Wir werden die Kommunen dabei unterstützen, inklusive Sozialräume zu schaffen.","We will support local authorities in creating inclusive social spaces.","503",NA
"Die Kinder- und Jugendhilfe soll für alle da sein – für Kinder und Jugendliche mit und ohne Behinderung.","Child and youth welfare should be there for everyone - for children and young people with and without disabilities.","504",NA
"Sie muss entsprechend ausgestattet werden.","It must be equipped accordingly.","504",NA
"Wir wollen in der Kinder- und Jugendhilfe alle Leistungen zusammenführen, um die Betreuung von Familien aus einer Hand zu gewährleisten.","We want to bring together all services in child and youth welfare to ensure that families receive care from a single source.","302",NA
"Integration und Teilhabe – die deutsche Einwanderungsgesellschaft gestalten:","Integration and Participation - Shaping the German Immigration Society:","H",NA
"Deutschland ist seit langem ein Einwanderungsland.","Germany has long been a country of immigration.","602.2",NA
"Das verlangt eine umfassende Integrationspolitik.","This requires a comprehensive integration policy.","607.2",NA
"Dabei stellen wir uns einer doppelten Integrationsaufgabe: zum einen der Integration der Menschen, die einwandern oder zu uns fliehen.","In doing so, we face a double integration task: on the one hand, the integration of people who immigrate or flee to us.","607.2",NA
"Und zum anderen der Aufgabe, den Zusammenhalt der ganzen Gesellschaft zu wahren.","And secondly, the task of maintaining the cohesion of society as a whole.","606.1",NA
"Wir leben in einer vielfältigen Gesellschaft, die auf gemeinsamen Werten und Normen beruht.","We live in a diverse society based on shared values and norms.","607.1",NA
"Grundlage für alle ist das Grundgesetz.","The basis for all is the Basic Law.","203",NA
"Gleiche Chancen auf Teilhabe für alle ist unser Leitbild.","Equal opportunities for participation for all is our guiding principle.","503",NA
"Niemand darf wegen seiner Einwanderungsgeschichte oder seines kulturellen oder religiösen Hintergrundes schlechtere Chancen haben.","No one should have fewer opportunities because of their immigration history or cultural or religious background.","503",NA
"Das heißt auch: Allen Kindern soll der Besuch einer Kita ermöglicht werden.","This also means that all children should be able to attend a daycare center.","504",NA
"Kinder, die in der Kita waren, haben von vornherein bessere Startchancen in der Schule.","Children who have been to daycare have better chances of starting school from the outset.","504",NA
"Schule und Bildung sind der Schlüssel zu einer Zukunft mit guten Chancen für alle Kinder.","School and education are the key to a future with good opportunities for all children.","506",NA
"Bei denjenigen, die als Jugendliche zu uns kommen, allein oder mit ihren Eltern, darf das Ende der (Berufs-)Schulpflicht nicht dazu führen, dass Jugendliche keine Chance erhalten, eine Schule zu besuchen.","For those who come to us as young people, alone or with their parents, the end of compulsory (vocational) education must not mean that young people do not get the chance to attend school.","503",NA
"Die Berufsschulen haben eine Brückenfunktion bei Spracherwerb und ersten praktischen Erfahrungen.","Vocational schools have a bridging function in language acquisition and initial practical experience.","503",NA
"Darin werden wir sie stärken.","We will strengthen them in this.","506",NA
"Schule und Bildung sind der Schlüssel zu einer Zukunft mit guten Chancen auf Integration.","School and education are the key to a future with good chances for integration.","607.2",NA
"Deshalb darf das Ende der (Berufs-)Schulpflicht nicht dazu führen, dass Jugendliche keine Chance erhalten, eine Schule zu besuchen.","Therefore, the end of compulsory (vocational) education must not result in young people not being given the chance to attend school.","503",NA
"Gleichzeitig werden wir die Anerkennung von ausländischen Bildungsabschlüssen verbessern.","At the same time, we will improve the recognition of foreign educational qualifications.","607.2",NA
"Wir wollen den Anteil von Auszubildenden mit familiären Einwanderungsgeschichten steigern.","We want to increase the proportion of trainees with family histories of immigration.","607.2",NA
"Und wir wollen mehr Studierende mit familiären Einwanderungsgeschichten an Universitäten und Fachhochschulen.","And we want more students with family immigration histories at universities and colleges.","607.2",NA
"Dazu werden wir sichere Zukunftsperspektiven für ausländische Studierende in Deutschland schaffen.","To this end, we will create secure future prospects for foreign students in Germany.","607.2",NA
"Wer hier erfolgreich ein Studium abgeschlossen hat, soll ein dauerhaftes Aufenthaltsrecht erhalten.","Those who have successfully completed their studies here are to be granted a permanent right of residence.","607.2",NA
"Integrationskurse sollen besser auf Zielgruppen ausgerichtet werden.","Integration courses are to be better geared to target groups.","607.2",NA
"Sie sollen außerdem grundsätzlich allen Asylbewerberinnen und Asylbewerbern sowie Geduldeten offenstehen, sofern nicht von vornherein klar ist, dass sie nicht in Deutschland bleiben.","They should also be open to all asylum seekers and tolerated persons, unless it is clear from the outset that they will not remain in Germany.","607.2",NA
"Wir wollen die Integrationskurse und die berufsbezogene Sprachförderung besser mit arbeitsmarktpolitischen Maßnahmen wie der Berufsorientierung, der Ausbildung und der Beschäftigung in Betrieben verbinden.","We want to better link integration courses and job-related language support with labor market policy measures such as career orientation, training and employment in companies.","412",NA
"( ... )","( ... )","000",NA
"Wir wollen besonders auch Frauen und Mütter aus Einwanderungsfamilien erreichen.","We also want to reach women and mothers from immigrant families in particular.","607.2",NA
"Denn sie sind entscheidend für die gelingende Integration der ganzen Familie.","Because they are crucial for the successful integration of the whole family.","607.2",NA
"Ein zentrales Element bei der Anerkennung von Studien- und Berufsabschlüssen und Nachqualifizierung ist die Verzahnung von Kompetenzfeststellung und Arbeitsmarktintegration.","A central element in the recognition of academic and vocational qualifications and post-qualification is the dovetailing of skills assessment and labor market integration.","602.2",NA
"Jedem und jeder soll eine Kompetenzfeststellung ermöglicht werden.","Everyone and anyone should be able to have a skills assessment.","602.2",NA
"Die Kosten für Anerkennungsverfahren werden wir sozialverträglich gestalten und einen Rechtsanspruch auf Beratung zu Anerkennungsverfahren festschreiben.","We will make the costs of recognition procedures socially acceptable and establish a legal right to counseling on recognition procedures.","504",NA
"Wir haben dafür gesorgt, dass Schutzsuchende, die sich in einer dualen Ausbildung befinden, diese unabhängig vom Ausgang ihres Asylverfahrens beenden und sich danach auch auf dem deutschen Arbeitsmarkt bewerben können (3+2-Regelung).","We have ensured that protection seekers who are undergoing dual training can complete it regardless of the outcome of their asylum procedure and can then also apply for a job in the German labor market (3+2 rule).","305.1",NA
"Wir werden dafür sorgen, dass diese auch für Ausbildungsbetriebe wichtige Regelung mit Leben erfüllt wird.","We will ensure that this regulation, which is also important for training companies, is filled with life.","412",NA
"Darüber hinaus prüfen wir eine analoge Regelung für aktiv Studierende.","In addition, we are examining an analogous regulation for active students.","412",NA
"In unserem Land haben rund 20 Prozent der Menschen einen Migrationshintergrund.","In our country, around 20 percent of people have a migration background.","607.1",NA
"Wir wollen, dass sich der Anteil von Menschen mit familiären Einwanderungsgeschichten auch in der Zusammensetzung des öffentlichen Dienstes niederschlägt.","We want the proportion of people with family histories of immigration to be reflected in the composition of the civil service.","607.2",NA
"Zielvorgaben, Ausbildungskampagnen und faire Bewerbungsverfahren unterstützen diesen Prozess.","Target setting, training campaigns and fair application procedures support this process.","503",NA
"Dazu gehört auch die Offenheit gegenüber unterschiedlichen Kulturen, die wir in allen gesellschaftlichen Bereichen umsetzen wollen, insbesondere in der Aus- und Weiterbildung der Gesundheits- und Pflegeberufe.","This also includes openness to different cultures, which we want to implement in all areas of society, especially in the education and training of the health and nursing professions.","607.2",NA
"Wir sollen mehr über die Auswirkungen von Ein- und Auswanderungen auf den gesellschaftlichen Wandel erfahren.","We are to learn more about the impact of immigration and emigration on social change.","411",NA
"Dafür sind wissenschaftsbasierte Analysen notwendig.","This requires science-based analyses.","411",NA
"Wir haben uns erfolgreich für eine nachhaltige, institutionelle Stärkung der Migrations- und Integrationsforschung und eine bessere Vernetzung der Forschenden eingesetzt und wollen dies noch weiter vorantreiben.","We have successfully campaigned for a sustainable, institutional strengthening of migration and integration research and better networking among researchers, and we intend to push this even further.","411",NA
"Ein modernes Staatsangehörigkeitsrecht ist eine wesentliche Voraussetzung für Integration.","A modern citizenship law is an essential prerequisite for integration.","607.2",NA
"Wir setzen uns weiterhin für die Akzeptanz von Mehrstaatigkeit für in Deutschland geborene Kinder ausländischer Eltern sowie bei Einbürgerungen ein.","We continue to advocate the acceptance of multiple citizenship for children born in Germany to foreign parents and for naturalizations.","607.2",NA
"Für in Deutschland geborene Kinder ausländischer Eltern haben wir die Optionspflicht abgeschafft.","We have abolished the option obligation for children born in Germany to foreign parents.","305.1",NA
"Wir stehen weiterhin zu dem Prinzip der Mehrstaatigkeit.","We continue to stand by the principle of multiple nationality.","607.2",NA
"Gilt dieses Prinzip in der Einbürgerungspraxis in Deutschland, wollen wir durch bilaterale Abkommen mit anderen Staaten die wechselseitige Akzeptanz stärken und prüfen, inwiefern der Vorschlag des Sachverständigenrates Deutscher Stiftungen für Integration und Migration für ein modernes Staatsangehörigkeitsrecht umsetzbar ist.","If this principle applies in naturalization practice in Germany, we want to strengthen mutual acceptance through bilateral agreements with other states and examine the extent to which the proposal of the Expert Council of German Foundations for Integration and Migration for a modern citizenship law can be implemented.","607.2",NA
"Sport und Kultur sind ein starker Integrationsmotor.","Sport and culture are a powerful driver of integration.","502",NA
"Hier kommen Menschen zusammen, lernen sich kennen und bauen Vorurteile ab.","This is where people come together, get to know each other and break down prejudices.","502",NA
"Wir sind stolz auf alle Vereine","We are proud of all the associations","502",NA
"und die vielen Ehrenamtlichen, die sich für das Miteinander einsetzen.","and the many volunteers who work for the togetherness.","606.1",NA
"Dieses Engagement werden wir weiterhin unterstützen.","We will continue to support this commitment.","502",NA
"Das gilt auch für alle Einrichtungen und Orte, die Begegnung ermöglichen – Vereine, Gewerkschaften, Kirchen, Religionsgemeinschaften oder Bürgerinitiativen.","This also applies to all institutions and places that facilitate encounters - associations, trade unions, churches, religious communities or citizens' initiatives.","502",NA
"Sport ist auch eine gute Gelegenheit, in vielfältiger Weise Vielfalt zu fördern.","Sports are also a great opportunity to promote diversity in a variety of ways.","502",NA
"Wir wollen gute Rahmenbedingungen schaffen: für ehrenamtliche Projekte im Sport, die ethnische Barrieren überwinden helfen, die Homo-, Bi-, Inter- und Transphobie etwas entgegensetzen oder die in anderer Form den Zusammenhalt in der Gesellschaft fördern.","We want to create good framework conditions: for volunteer projects in sports that help overcome ethnic barriers, that counter homo-, bi-, inter- and transphobia, or that promote cohesion in society in other ways.","606.1",NA
"Der interreligiöse Dialog und das Wissen über Religionen und Kulturen sind wichtig für ein friedliches Miteinander und gegenseitigen Respekt.","Interreligious dialogue and knowledge about religions and cultures are important for peaceful coexistence and mutual respect.","607.2",NA
"Wer ein aufgeklärtes Wissen über die eigene und andere Religionen hat, ist oft weniger anfällig für Extremismus.","Those who have an enlightened knowledge of their own and other religions are often less prone to extremism.","202.1",NA
"Wir wollen daher allen Kindern Religions- und Ethikunterricht ermöglichen.","We therefore want to make religious and ethics education available to all children.","506",NA
"Wir unterstützen den islamischen Religionsunterricht an staatlichen Schulen und in deutscher Sprache auch aus präventiven Gründen.","We support Islamic religious instruction in state schools and in the German language also for preventive reasons.","607.2",NA
"Dabei verfolgen wir das Ziel, dass islamische Religionslehrerinnen und -lehrer sowie Imame an deutschen Lehrstühlen ausgebildet werden.","Our goal is to ensure that Islamic religious teachers and imams are trained at German university chairs.","607.2",NA
"Muslime und der Islam sind Teil unseres Landes.","Muslims and Islam are part of our country.","607.2",NA
"Wir unterstützen die organisatorische Entwicklung von muslimischen Gemeinden und Organisationen, wenn sie sich in Deutschland nach deutschem Recht gründen","We support the organizational development of Muslim communities and organizations if they establish themselves in Germany in accordance with German law","607.2",NA
"und wenn sie die freiheitliche demokratische Grundordnung achten.","and if they respect the free democratic basic order.","202.1",NA
"Erfüllen sie die Voraussetzungen, dann stehen ihnen auch die Möglichkeiten unseres bewährten Religionsverfassungsrechts offen.","If they meet the requirements, then the possibilities of our proven religious constitutional law are also open to them.","607.2",NA
"Kulturpolitik:","Cultural Policy:","H",NA
"Eine offene und moderne Gesellschaft braucht gelebte Kunst und Kultur, die sie spiegelt, kritisiert und voranbringt.","An open and modern society needs living art and culture that reflects, criticizes and advances it.","502",NA
"Kunst und Kultur sind Ausdruck des menschlichen Daseins.","Art and culture are expressions of human existence.","502",NA
"Kultur regt Diskurse an und trägt zur Identitätsbildung und Entwicklung jedes und jeder Einzelnen bei.","Culture stimulates discourse and contributes to the identity formation and development of each and every individual.","502",NA
"Kunst und Kultur sind frei.","Art and culture are free.","502",NA
"In Zeiten des wachsenden Populismus ist eine offene Kultur der Schlüssel zum Dialog.","In times of growing populism, an open culture is the key to dialogue.","502",NA
"Kultur macht Neues erfahrbar, baut Brücken zu Unbekanntem und kann für mehr Verständigung sorgen.","Culture makes it possible to experience new things, builds bridges to the unknown and can ensure greater understanding.","502",NA
"Die Ausdrucksformen sind vielfältig – wie unser Kulturverständnis.","The forms of expression are diverse - just like our understanding of culture.","502",NA
"Klassische Orchester gehören dazu, genauso wie Laienchöre, Rock- und Popmusik, die elektronische Musik, Museen, soziokulturelle Zentren, Theater, Kinos und Literatur und die Spielebranche.","Classical orchestras are included, as are amateur choirs, rock and pop music, electronic music, museums, socio-cultural centers, theaters, cinemas and literature, and the gaming industry.","502",NA
"Die SPD steht zu ihrem Anspruch „Kultur für alle“: Wir ermöglichen Kultur unabhängig von Geldbeutel, Schulabschluss, Alter, Geschlecht oder Herkunft.","The SPD stands by its claim of ""culture for all"": we make culture possible regardless of purse, school-leaving qualification, age, gender or origin.","503",NA
"Migrantische Communities haben einen positiven kulturellen Einfluss – das schätzen wir.","Migrant communities have a positive cultural impact - we appreciate that.","607.2",NA
"Kultur soll auch weiterhin „von allen“ getragen werden, hier hat die öffentliche Hand den Auftrag, eine Grundversorgung sicherzustellen.","Culture should continue to be borne ""by all""; here the public sector has a mandate to ensure a basic service.","502",NA
"Bürgerinnen und Bürger wie auch die Kulturwirtschaft sind wesentliche Akteure.","Citizens as well as the cultural industry are essential actors.","502",NA
"Wir wollen mit öffentlicher Kulturförderung ein breites kulturelles Angebot zu sozialverträglichen Preisen ermöglichen.","We want to use public cultural funding to enable a wide range of cultural activities at socially acceptable prices.","502",NA
"Darüber hinaus sollen alle Einrichtungen, die vom Bund gefördert werden, einmal im Monat einen kostenlosen Eintritt anbieten.","In addition, all federally funded facilities should offer free admission once a month.","503",NA
"Die Kreativwirtschaft wollen wir stärken und umfassend fördern.","We want to strengthen and comprehensively promote the creative industries.","502",NA
"Wir bekennen uns zum kooperativen Kulturföderalismus.","We are committed to cooperative cultural federalism.","502",NA
"Bund, Länder und Kommunen müssen ihre Förderaktivitäten noch stärker als bisher miteinander abstimmen und gemeinsam im Sinne einer konzeptionellen Kulturpolitik Prioritäten setzen.","The federal, state and local governments must coordinate their funding activities even more closely than before and jointly set priorities in the sense of a conceptual cultural policy.","502",NA
"Wir stehen an der Seite der Künstlerinnen und Künstler.","We stand by the side of the artists.","502",NA
"Wir werden ihre Rechte stärken und sie sozial besser absichern.","We will strengthen their rights and provide them with better social security.","504",NA
"Sie müssen von ihrer Arbeit leben können.","They must be able to live from their work.","504",NA
"Dabei verlieren wir jedoch die anderen Akteure des Kunst- und Kulturbereichs nicht aus dem Blick.","However, we do not lose sight of the other players in the arts and culture sector.","503",NA
"Wir setzen uns für gerechte Aushandlungsprozesse ein, um kulturelle Vielfalt und soziale Gerechtigkeit voranzubringen.","We advocate for equitable negotiation processes to advance cultural diversity and social justice.","503",NA
"Bei Bundeskulturförderungen werden wir für gerechte Vergütungsregeln sorgen.","We will ensure fair compensation rules for federal cultural grants.","503",NA
"Der Bund und die Kultureinrichtungen des Bundes müssen dabei mit gutem Beispiel zur fairen Bezahlung von Angestellten und Honorarkräften vorangehen.","The federal government and the federal cultural institutions must set a good example in this regard for the fair payment of employees and honorary staff.","701",NA
"Wir machen uns für Mindestvergütungen und Ausstellungsvergütungen stark und prüfen die Einführung eines Künstlergemeinschaftsrechts.","We are campaigning for minimum remuneration and exhibition fees, and are looking into the introduction of an artists' collective right.","412",NA
"Die solidarische Finanzierung der Künstlersozialkasse durch die Kulturschaffenden, die Verwerter und durch den Staat ist für die SPD nicht verhandelbar.","For the SPD, the solidarity-based financing of the artists' social security fund by the creators, the exploiters and the state is non-negotiable.","504",NA
"Flexiblere Beschäftigungsstrukturen, veränderte Erwerbsbiografien und die schwierigen Einkommensverhältnisse machen es freiberuflichen Kulturschaffenden zunehmend schwer, Risiken von Krankheit, Pflegebedürftigkeit und Arbeitslosigkeit abzufedern und für das Alter vorzusorgen.","More flexible employment structures, changing employment biographies and the difficult income situation make it increasingly difficult for freelance cultural workers to cushion the risks of illness, need for care and unemployment and to provide for old age.","504",NA
"Deshalb wollen wir Solo-Selbstständige möglichst umfassend in die verschiedenen Zweige der gesetzlichen Sozialversicherung einbinden.","That is why we want to include solo self-employed persons as comprehensively as possible in the various branches of statutory social insurance.","504",NA
"Spezifische Versorgungssysteme, die einen der gesetzlichen Rentenversicherung vergleichbaren Leistungsumfang bieten, wie die Künstlersozialkasse, sollen davon ausgenommen werden.","Specific pension schemes that offer a scope of benefits comparable to the statutory pension insurance, such as the artists' social insurance fund, are to be exempted.","504",NA
"Kunst- und Kulturförderung sind für die gesamte Gesellschaft da.","Arts and culture promotion are there for the whole society.","502",NA
"Wir wollen Kunst um ihrer selbst willen fördern und nicht erst dann, wenn sie ökonomischen, sozialen oder politischen Zwecken nützt.","We want to promote art for its own sake and not only when it serves economic, social or political purposes.","502",NA
"Bei Projektförderungen soll stärker auf Expertenjurys zurückgegriffen werden.","Greater use should be made of expert juries for project funding.","502",NA
"Die Entscheidung, was und wie gefördert wird, muss auch nach Geschlechtergerechtigkeit, Inklusion, Nachhaltigkeit, Integration und Aspekten kultureller Bildung getroffen werden.","Decisions about what to fund and how to fund it must also be made according to gender equity, inclusion, sustainability, integration, and aspects of arts education.","503",NA
"Die Kulturförderung im digitalen Bereich soll den Zugang zu künstlerischen Werken verbessern –","Cultural funding in the digital realm is intended to improve access to artistic works -","502",NA
"insbesondere für diejenigen, die bisher von Kunst und Kultur ausgeschlossen sind.","especially for those who have been excluded from art and culture up to now.","503",NA
"Wir wollen die Dynamik der freien Kulturszene verstärkt nutzen und ihre Impulse für unsere Gesellschaft aufgreifen.","We want to make greater use of the dynamics of the independent cultural scene and take up its impulses for our society.","502",NA
"Die noch immer gebräuchliche Unterscheidung zwischen Hoch- und Subkultur ist für uns veraltet und irreführend.","The still common distinction between high culture and subculture is outdated and misleading for us.","502",NA
"Für uns gibt es nur Kultur!","For us there is only culture!","502",NA
"Das erfolgreiche Instrument der Kulturentwicklungsplanung (Blaubuch der kulturellen Leuchttürme) für Deutschland werden wir neu auflegen.","We will relaunch the successful instrument of cultural development planning (Blue Book of Cultural Lighthouses) for Germany.","502",NA
"Im Bereich der wirtschaftlichen Filmförderung wollen wir den Deutschen Filmförderfonds (DFFF) weiterentwickeln.","In the area of economic film funding, we want to further develop the German Federal Film Fund (DFFF).","502",NA
"Unsere vielfältige Kinolandschaft wollen wir erhalten und die Rahmenbedingungen für künstlerisch herausragende Filme stärken.","We want to preserve our diverse cinema landscape and strengthen the framework conditions for artistically outstanding films.","502",NA
"Auch die Entwicklung innovativer und kulturell wertvoller Computer- und Videospiele wollen wir fördern, denn Computerspiele haben sich zu einem Kulturgut entwickelt.","We also want to promote the development of innovative and culturally valuable computer and video games, because computer games have become a cultural asset.","502",NA
"Wir wollen unser kulturelles Erbe bewahren und erlebbar machen.","We want to preserve our cultural heritage and bring it to life.","502",NA
